property_url,property_id,listing_id,mls,mls_id,status,text,style,full_street_line,street,unit,city,state,zip_code,beds,full_baths,half_baths,sqft,year_built,days_on_mls,list_price,list_price_min,list_price_max,list_date,sold_price,last_sold_date,assessed_value,estimated_value,tax,tax_history,new_construction,lot_sqft,price_per_sqft,latitude,longitude,neighborhoods,county,fips_code,stories,hoa_fee,parking_garage,agent_id,agent_name,agent_email,agent_phones,agent_mls_set,agent_nrds_id,broker_id,broker_name,builder_id,builder_name,office_id,office_mls_set,office_name,office_email,office_phones,nearby_schools,primary_photo,alt_photos
https://www.realtor.com/rentals/details/3189-Wheeling-St_Aurora_CO_80011_M27062-23017,2706223017,2977911433,TRBO,1737267,FOR_RENT,"Welcome to this 1 bedroom with tons of room in a home. Five minutes to Anschutz Medical Campus & Light Rail! Close to Sand Creek Open Space. Multiple shared spaces include: living room, kitchen, dining room. The common areas are furnished. This rental listing is for one unfurnished bedroom with shared bathroom. Located close to everything including I-225, Light Rail, Restaurants, Shopping and Park Lane Park which features Sports Fields, Outdoor Pool, and Playground Areas. Featuring large backyard with covered patio! Amenities: Newly Remodeled Kitchen and Bathroom. Large Living Room. Washer/Dryer included. Dishwasher. Central Heating and Air Conditioning. Fenced Yard. Storage on site. Rent: $750 + Utilities Security Deposit: $500 Application Fee: $45 Utilities ($100) includes: All utilities (water, sewer, trash, gas and electric, Wi-Fi) Rental Qualifications: Proof of income equal to 3x the monthly rent amount. Background and Credit check required. Contact to Tour To apply, visit TurboTenant and search for Property ID 1737267",SINGLE_FAMILY,3189 Wheeling St,3189 Wheeling St,,Aurora,CO,80011,1,1,,,,0,750,,,2025-02-03,,,22320,471585,2536,"[{'year': 2022, 'tax': 2536, 'assessment': {'building': 16830, 'land': 5490, 'total': 22320}}, {'year': 2021, 'tax': 1819, 'assessment': {'building': 17310, 'land': 5650, 'total': 22960}}, {'year': 2020, 'tax': 1923, 'assessment': {'building': 17800, 'land': 5650, 'total': 23450}}, {'year': 2019, 'tax': 1920, 'assessment': {'building': 17800, 'land': 5650, 'total': 23450}}, {'year': 2018, 'tax': 1264, 'assessment': {'building': 12850, 'land': 5040, 'total': 17890}}, {'year': 2017, 'tax': 1123, 'assessment': {'building': 12850, 'land': 5040, 'total': 17890}}, {'year': 2016, 'tax': 722, 'assessment': {'building': 11040, 'land': 2590, 'total': 13630}}, {'year': 2015, 'tax': 699, 'assessment': {'building': 5520, 'land': 1290, 'total': 6810}}, {'year': 2014, 'tax': 582, 'assessment': {'building': 4520, 'land': 1070, 'total': 5590}}, {'year': 2013, 'tax': 587, 'assessment': {'building': 4520, 'land': 1070, 'total': 5590}}, {'year': 2011, 'tax': 1068, 'assessment': {'building': 9510, 'land': 2070, 'total': 11580}}, {'year': 2010, 'tax': 1089, 'assessment': {'building': 9510, 'land': 2070, 'total': 11580}}, {'year': 2009, 'tax': 1082, 'assessment': {'building': 9620, 'land': 2230, 'total': 11850}}, {'year': 2007, 'tax': 615, 'assessment': {'building': 12070, 'land': 2630, 'total': 14700}}]",False,,,39.761719,-104.831208,Morris Heights,Adams,08001,,,,,,,,,,,,,,,,,,,Adams-Arapahoe 28j School District,http://ap.rdcpix.com/0e359001839f31943b342c51a3472e03l-m3650691288od-w480_h360_x2.webp?w=1080&q=75,"http://ap.rdcpix.com/0e359001839f31943b342c51a3472e03l-m3650691288od-w480_h360_x2.webp?w=1080&q=75, http://ap.rdcpix.com/0e359001839f31943b342c51a3472e03l-m2684423366od-w480_h360_x2.webp?w=1080&q=75, http://ap.rdcpix.com/0e359001839f31943b342c51a3472e03l-m970641372od-w480_h360_x2.webp?w=1080&q=75, http://ap.rdcpix.com/0e359001839f31943b342c51a3472e03l-m1320929530od-w480_h360_x2.webp?w=1080&q=75, http://ap.rdcpix.com/0e359001839f31943b342c51a3472e03l-m2624827417od-w480_h360_x2.webp?w=1080&q=75, http://ap.rdcpix.com/0e359001839f31943b342c51a3472e03l-m727352333od-w480_h360_x2.webp?w=1080&q=75"
https://www.realtor.com/rentals/details/2111-S-Olathe-St_Aurora_CO_80013_M28581-57487,2858157487,2977692649,TRIR,646420,FOR_RENT,"Featuring sparkling community pool Take a look at this beautiful home featuring 4 bedrooms, 2.0 bathrooms, and approximately 2,032 square feet. Enjoy the freedom of a virtually maintenance free lifestyle while residing in a great community. This home is professionally managed and maintained by Tricon Residential. - Please beware of leasing fraud If someone other than an official Tricon Residential leasing agent attempts to rent you a home that is owned and professionally managed by Tricon Residential, please call our Fraud Prevention Hotline at 877.241.9085 or email us at FraudTriconResidential.com. To learn more, visit triconresidential.com/resources/fraud-prevention. - Please note that January 2025 move-in dates may be delayed for certain Tricon homes. If you need to move into a home in January, please consult with your leasing agent to confirm availability for your desired home. - This home may be in a community that has rental registration requirements. If so, please note that your move-in date may be delayed pending rental registration approval. Please consult with your leasing agent for more details. - There is an application fee of $55 per occupant aged 18 or older. Completed applications are considered on a ""first-come, first-served"" basis. There is a holding deposit of $250 per home, which is credited to the approved applicant's first month's rent after move-in, refunded if the application is denied, or forfeited if the move-in is canceled by an approved applicant. Approved applicants are required to execute a Lease Agreement and submit the full security deposit within 48 hours after approval of the Lease. The Lease start date must be within 10 days after approval (certain exceptions may apply at Tricon Single-Family Rental Communities). This requirement is applicable even if an approved applicant has not seen the inside of the home. Tricon Residential is proud to be an Equal Opportunity Housing Provider. - Minimum lease term is one-year (13 mos. for homes in California). We collect a security deposit equal to one month's rent for all new leases. Resident pays for all utilities including trash, sewer, and water. - For homes with an available lease term greater than 18 months, a 3.5 annual base rent escalation will apply. - Animals approved with pet fee (except for new leases in California) and monthly pet rent. The following dog breeds and types, whether full or mixed, are prohibited: American Pit Bull Terrier, American Staffordshire Terrier, Bull Mastiff, Cane Corso, Chow, Doberman, Dogo Argentino, Pit Bull, Presa Canario, Rottweiler, Wolf, Wolf hybrids, any combination mix of the foregoing breeds, and any other breed or type that Landlord deems to have similar characteristics. Maximum of two animals allowed per home. - Pricing displayed reflects the lowest option for a given lease term and is deemed reliable but not guaranteed. Actual pricing will vary based on the options selected. We may revise the pricing for products and services we offer without prior notice. - A Pool Maintenance Fee of $150 per month applies to any home with a private pool. A Smart Home Fee of $34.95 per month applies to any home with Smart Home technology with Video Doorbell. A monthly Solar Fee will apply to certain homes equipped with a solar system the fee varies by home. The energy generated by the solar systems can result in a credit to offset utility costs. An administrative fee is due prior to move-in. Other mandatory fees or charges may apply review the Lease carefully for a full list of applicable fees and charges. - Tricon makes every effort to display accurate home amenity charge information. However, on rare occasions, a home may have an amenity (and a related charge) that is not reflected on our website. To double-check the amenity charges for this home, please consult with your leasing agent. - All Promotions are subject to the specific terms, conditions, and restrictions disclosed in connection therewith, and are subject to being changed or discontinued without notice. Photos are representative only and may not reflect the home's current appliances or other features. If you have specific questions about a home's features, please contact us. While we strive for accuracy, pricing, availability, and other listing information may include technical inaccuracies or typographical errors. - Other terms and conditions apply. Refer to our online Terms of Agreement for more details. - This home has a septic system, Tricon will arrange for periodic inspections, maintenance, and pumping. We charge $35 per month to cover the cost of this service. - A fee of $55.00 will be included in your monthly Services and Amenities fee for high-speed internet. - This home is equipped with in-home laundry appliances, which Tricon will provide and maintain. We charge $35 per month for homes with in-place washer/dryers. Offer expires on Sunday, February 16, 2025. Valid only on select vacant, move-in ready units subject to availability and approved application screening. Valid only for new, qualifying applicants 18 years or older offer does not apply to renewals or additional residents in occupied homes. Minimum lease term may be required, and this offer cannot be combined with any other offers. Tricon Residential may change or cancel this offer at any time in its sole discretion. Additional terms, conditions, and other restrictions apply contact the leasing office for details.",SINGLE_FAMILY,2111 S Olathe St,2111 S Olathe St,,Aurora,CO,80013,,,,,1974,6,,2849,,2025-01-28,495000,2021-09-13,23485,484000,2358,"[{'year': 2022, 'tax': 2358, 'assessment': {'building': 16882, 'land': 6603, 'total': 23485}}, {'year': 2021, 'tax': 1713, 'assessment': {'building': 17367, 'land': 6793, 'total': 24160}}, {'year': 2020, 'tax': 1573, 'assessment': {'building': 15473, 'land': 6793, 'total': 22266}}, {'year': 2019, 'tax': 1565, 'assessment': {'building': 15473, 'land': 6793, 'total': 22266}}, {'year': 2018, 'tax': 1196, 'assessment': {'building': 14558, 'land': 3960, 'total': 18518}}, {'year': 2017, 'tax': 1041, 'assessment': {'building': 14558, 'land': 3960, 'total': 18518}}, {'year': 2016, 'tax': 1445, 'assessment': {'building': 12999, 'land': 2388, 'total': 15387}}, {'year': 2015, 'tax': 1395, 'assessment': {'building': 12999, 'land': 2388, 'total': 15387}}, {'year': 2014, 'tax': 1077, 'assessment': {'building': 9058, 'land': 2388, 'total': 11446}}, {'year': 2013, 'tax': 1092, 'assessment': {'building': 9058, 'land': 2388, 'total': 11446}}, {'year': 2012, 'tax': 1162, 'assessment': {'building': None, 'land': None, 'total': 12650}}, {'year': 2010, 'tax': 1024, 'assessment': {'building': None, 'land': None, 'total': 12650}}, {'year': 2008, 'tax': 1236, 'assessment': {'building': 10650, 'land': 1990, 'total': 12640}}, {'year': 2007, 'tax': 1111, 'assessment': {'building': 13200, 'land': 2230, 'total': 15430}}]",False,,,39.678657,-104.792995,Horseshoe Park,Arapahoe,08005,,,,,,,,,,,,,,,,,,,Adams-Arapahoe 28j School District,http://ar.rdcpix.com/1f6fa837ae6405e16b81a5e27a224d84c-f2314514471od-w480_h360_x2.webp?w=1080&q=75,"http://ar.rdcpix.com/1f6fa837ae6405e16b81a5e27a224d84c-f2314514471od-w480_h360_x2.webp?w=1080&q=75, http://ar.rdcpix.com/1f6fa837ae6405e16b81a5e27a224d84c-f2072298607od-w480_h360_x2.webp?w=1080&q=75, http://ar.rdcpix.com/1f6fa837ae6405e16b81a5e27a224d84c-f2451942103od-w480_h360_x2.webp?w=1080&q=75, http://ar.rdcpix.com/1f6fa837ae6405e16b81a5e27a224d84c-f3055327227od-w480_h360_x2.webp?w=1080&q=75, http://ar.rdcpix.com/1f6fa837ae6405e16b81a5e27a224d84c-f913595336od-w480_h360_x2.webp?w=1080&q=75, http://ar.rdcpix.com/1f6fa837ae6405e16b81a5e27a224d84c-f3881942551od-w480_h360_x2.webp?w=1080&q=75, http://ar.rdcpix.com/1f6fa837ae6405e16b81a5e27a224d84c-f1683328783od-w480_h360_x2.webp?w=1080&q=75, http://ar.rdcpix.com/1f6fa837ae6405e16b81a5e27a224d84c-f2181666313od-w480_h360_x2.webp?w=1080&q=75, http://ar.rdcpix.com/1f6fa837ae6405e16b81a5e27a224d84c-f1218954533od-w480_h360_x2.webp?w=1080&q=75, http://ar.rdcpix.com/1f6fa837ae6405e16b81a5e27a224d84c-f3639387557od-w480_h360_x2.webp?w=1080&q=75, http://ar.rdcpix.com/1f6fa837ae6405e16b81a5e27a224d84c-f132090130od-w480_h360_x2.webp?w=1080&q=75, http://ar.rdcpix.com/1f6fa837ae6405e16b81a5e27a224d84c-f3837095162od-w480_h360_x2.webp?w=1080&q=75, http://ar.rdcpix.com/1f6fa837ae6405e16b81a5e27a224d84c-f3574965176od-w480_h360_x2.webp?w=1080&q=75, http://ar.rdcpix.com/1f6fa837ae6405e16b81a5e27a224d84c-f661372163od-w480_h360_x2.webp?w=1080&q=75, http://ar.rdcpix.com/1f6fa837ae6405e16b81a5e27a224d84c-f3741790192od-w480_h360_x2.webp?w=1080&q=75, http://ar.rdcpix.com/1f6fa837ae6405e16b81a5e27a224d84c-f1250598306od-w480_h360_x2.webp?w=1080&q=75, http://ar.rdcpix.com/1f6fa837ae6405e16b81a5e27a224d84c-f43507201od-w480_h360_x2.webp?w=1080&q=75, http://ar.rdcpix.com/1f6fa837ae6405e16b81a5e27a224d84c-f131196048od-w480_h360_x2.webp?w=1080&q=75, http://ar.rdcpix.com/1f6fa837ae6405e16b81a5e27a224d84c-f59650860od-w480_h360_x2.webp?w=1080&q=75, http://ar.rdcpix.com/1f6fa837ae6405e16b81a5e27a224d84c-f1450129950od-w480_h360_x2.webp?w=1080&q=75"
https://www.realtor.com/rentals/details/5153-S-Ukraine-St_Aurora_CO_80015_M12389-45285,1238945285,2977703337,TRIR,636234,FOR_RENT,"Take a look at this beautiful home featuring 6 bedrooms, 2.5 bathrooms, and approximately 2,766 square feet. Enjoy the freedom of a virtually maintenance free lifestyle while residing in a great community. This home is professionally managed and maintained by Tricon Residential. - Please beware of leasing fraud If someone other than an official Tricon Residential leasing agent attempts to rent you a home that is owned and professionally managed by Tricon Residential, please call our Fraud Prevention Hotline at 877.241.9085 or email us at FraudTriconResidential.com. To learn more, visit triconresidential.com/resources/fraud-prevention. - Please note that January 2025 move-in dates may be delayed for certain Tricon homes. If you need to move into a home in January, please consult with your leasing agent to confirm availability for your desired home. - This home may be in a community that has rental registration requirements. If so, please note that your move-in date may be delayed pending rental registration approval. Please consult with your leasing agent for more details. - There is an application fee of $55 per occupant aged 18 or older. Completed applications are considered on a ""first-come, first-served"" basis. There is a holding deposit of $250 per home, which is credited to the approved applicant's first month's rent after move-in, refunded if the application is denied, or forfeited if the move-in is canceled by an approved applicant. Approved applicants are required to execute a Lease Agreement and submit the full security deposit within 48 hours after approval of the Lease. The Lease start date must be within 10 days after approval (certain exceptions may apply at Tricon Single-Family Rental Communities). This requirement is applicable even if an approved applicant has not seen the inside of the home. Tricon Residential is proud to be an Equal Opportunity Housing Provider. - Minimum lease term is one-year (13 mos. for homes in California). We collect a security deposit equal to one month's rent for all new leases. Resident pays for all utilities including trash, sewer, and water. - For homes with an available lease term greater than 18 months, a 3.5 annual base rent escalation will apply. - Animals approved with pet fee (except for new leases in California) and monthly pet rent. The following dog breeds and types, whether full or mixed, are prohibited: American Pit Bull Terrier, American Staffordshire Terrier, Bull Mastiff, Cane Corso, Chow, Doberman, Dogo Argentino, Pit Bull, Presa Canario, Rottweiler, Wolf, Wolf hybrids, any combination mix of the foregoing breeds, and any other breed or type that Landlord deems to have similar characteristics. Maximum of two animals allowed per home. - Pricing displayed reflects the lowest option for a given lease term and is deemed reliable but not guaranteed. Actual pricing will vary based on the options selected. We may revise the pricing for products and services we offer without prior notice. - A Pool Maintenance Fee of $150 per month applies to any home with a private pool. A Smart Home Fee of $34.95 per month applies to any home with Smart Home technology with Video Doorbell. A monthly Solar Fee will apply to certain homes equipped with a solar system the fee varies by home. The energy generated by the solar systems can result in a credit to offset utility costs. An administrative fee is due prior to move-in. Other mandatory fees or charges may apply review the Lease carefully for a full list of applicable fees and charges. - Tricon makes every effort to display accurate home amenity charge information. However, on rare occasions, a home may have an amenity (and a related charge) that is not reflected on our website. To double-check the amenity charges for this home, please consult with your leasing agent. - All Promotions are subject to the specific terms, conditions, and restrictions disclosed in connection therewith, and are subject to being changed or discontinued without notice. Photos are representative only and may not reflect the home's current appliances or other features. If you have specific questions about a home's features, please contact us. While we strive for accuracy, pricing, availability, and other listing information may include technical inaccuracies or typographical errors. - Other terms and conditions apply. Refer to our online Terms of Agreement for more details. - This home is equipped with in-home laundry appliances, which Tricon will provide and maintain. We charge $35 per month for homes with in-place washer/dryers. Offer expires on Sunday, February 16, 2025. Valid only on select vacant, move-in ready units subject to availability and approved application screening. Valid only for new, qualifying applicants 18 years or older offer does not apply to renewals or additional residents in occupied homes. Minimum lease term may be required, and this offer cannot be combined with any other offers. Tricon Residential may change or cancel this offer at any time in its sole discretion. Additional terms, conditions, and other restrictions apply contact the leasing office for details.",SINGLE_FAMILY,5153 S Ukraine St,5153 S Ukraine St,,Aurora,CO,80015,,,,,1999,5,,3295,,2025-01-29,646800,2022-07-25,31394,582363,3636,"[{'year': 2022, 'tax': 3636, 'assessment': {'building': 22150, 'land': 9244, 'total': 31394}}, {'year': 2021, 'tax': 3663, 'assessment': {'building': 22787, 'land': 9510, 'total': 32297}}, {'year': 2020, 'tax': 3656, 'assessment': {'building': 22515, 'land': 9510, 'total': 32025}}, {'year': 2019, 'tax': 3547, 'assessment': {'building': 22515, 'land': 9510, 'total': 32025}}, {'year': 2018, 'tax': 3375, 'assessment': {'building': 23357, 'land': 4320, 'total': 27677}}, {'year': 2017, 'tax': 3326, 'assessment': {'building': 23357, 'land': 4320, 'total': 27677}}, {'year': 2016, 'tax': 3042, 'assessment': {'building': 21595, 'land': 2547, 'total': 24142}}, {'year': 2015, 'tax': 2951, 'assessment': {'building': 21595, 'land': 2547, 'total': 24142}}, {'year': 2014, 'tax': 2599, 'assessment': {'building': 17011, 'land': 2547, 'total': 19558}}, {'year': 2013, 'tax': 2621, 'assessment': {'building': 17011, 'land': 2547, 'total': 19558}}, {'year': 2012, 'tax': 2864, 'assessment': {'building': None, 'land': None, 'total': 21350}}, {'year': 2010, 'tax': 2370, 'assessment': {'building': None, 'land': None, 'total': 21350}}, {'year': 2008, 'tax': 2570, 'assessment': {'building': 16340, 'land': 2550, 'total': 18890}}, {'year': 2007, 'tax': 2518, 'assessment': {'building': 18680, 'land': 2390, 'total': 21070}}]",False,,,39.622713,-104.725023,Saddle Rock Ridge,Arapahoe,08005,,,,,,,,,,,,,,,,,,,Cherry Creek 5 School District,http://ar.rdcpix.com/0ee23d0ddd12f3bc139341bb0fbf5fd7c-f1231649437od-w480_h360_x2.webp?w=1080&q=75,"http://ar.rdcpix.com/0ee23d0ddd12f3bc139341bb0fbf5fd7c-f1231649437od-w480_h360_x2.webp?w=1080&q=75, http://ar.rdcpix.com/0ee23d0ddd12f3bc139341bb0fbf5fd7c-f1782780200od-w480_h360_x2.webp?w=1080&q=75, http://ar.rdcpix.com/0ee23d0ddd12f3bc139341bb0fbf5fd7c-f3768079594od-w480_h360_x2.webp?w=1080&q=75, http://ar.rdcpix.com/0ee23d0ddd12f3bc139341bb0fbf5fd7c-f3303177481od-w480_h360_x2.webp?w=1080&q=75, http://ar.rdcpix.com/0ee23d0ddd12f3bc139341bb0fbf5fd7c-f2831122103od-w480_h360_x2.webp?w=1080&q=75, http://ar.rdcpix.com/0ee23d0ddd12f3bc139341bb0fbf5fd7c-f3212207506od-w480_h360_x2.webp?w=1080&q=75, http://ar.rdcpix.com/0ee23d0ddd12f3bc139341bb0fbf5fd7c-f4257046152od-w480_h360_x2.webp?w=1080&q=75, http://ar.rdcpix.com/0ee23d0ddd12f3bc139341bb0fbf5fd7c-f2301812600od-w480_h360_x2.webp?w=1080&q=75, http://ar.rdcpix.com/0ee23d0ddd12f3bc139341bb0fbf5fd7c-f1768816565od-w480_h360_x2.webp?w=1080&q=75, http://ar.rdcpix.com/0ee23d0ddd12f3bc139341bb0fbf5fd7c-f2627067696od-w480_h360_x2.webp?w=1080&q=75, http://ar.rdcpix.com/0ee23d0ddd12f3bc139341bb0fbf5fd7c-f3304579207od-w480_h360_x2.webp?w=1080&q=75, http://ar.rdcpix.com/0ee23d0ddd12f3bc139341bb0fbf5fd7c-f940125101od-w480_h360_x2.webp?w=1080&q=75, http://ar.rdcpix.com/0ee23d0ddd12f3bc139341bb0fbf5fd7c-f3330202208od-w480_h360_x2.webp?w=1080&q=75, http://ar.rdcpix.com/0ee23d0ddd12f3bc139341bb0fbf5fd7c-f3139013519od-w480_h360_x2.webp?w=1080&q=75, http://ar.rdcpix.com/0ee23d0ddd12f3bc139341bb0fbf5fd7c-f2567646331od-w480_h360_x2.webp?w=1080&q=75, http://ar.rdcpix.com/0ee23d0ddd12f3bc139341bb0fbf5fd7c-f4001100638od-w480_h360_x2.webp?w=1080&q=75, http://ar.rdcpix.com/0ee23d0ddd12f3bc139341bb0fbf5fd7c-f751029181od-w480_h360_x2.webp?w=1080&q=75, http://ar.rdcpix.com/0ee23d0ddd12f3bc139341bb0fbf5fd7c-f4084390660od-w480_h360_x2.webp?w=1080&q=75, http://ar.rdcpix.com/0ee23d0ddd12f3bc139341bb0fbf5fd7c-f1707975147od-w480_h360_x2.webp?w=1080&q=75, http://ar.rdcpix.com/0ee23d0ddd12f3bc139341bb0fbf5fd7c-f1473128507od-w480_h360_x2.webp?w=1080&q=75, http://ar.rdcpix.com/0ee23d0ddd12f3bc139341bb0fbf5fd7c-f2635148356od-w480_h360_x2.webp?w=1080&q=75, http://ar.rdcpix.com/0ee23d0ddd12f3bc139341bb0fbf5fd7c-f1309005485od-w480_h360_x2.webp?w=1080&q=75, http://ar.rdcpix.com/0ee23d0ddd12f3bc139341bb0fbf5fd7c-f3311299057od-w480_h360_x2.webp?w=1080&q=75, http://ar.rdcpix.com/0ee23d0ddd12f3bc139341bb0fbf5fd7c-f3021668080od-w480_h360_x2.webp?w=1080&q=75, http://ar.rdcpix.com/0ee23d0ddd12f3bc139341bb0fbf5fd7c-f3218850234od-w480_h360_x2.webp?w=1080&q=75, http://ar.rdcpix.com/0ee23d0ddd12f3bc139341bb0fbf5fd7c-f2048399271od-w480_h360_x2.webp?w=1080&q=75, http://ar.rdcpix.com/0ee23d0ddd12f3bc139341bb0fbf5fd7c-f2543957654od-w480_h360_x2.webp?w=1080&q=75, http://ar.rdcpix.com/0ee23d0ddd12f3bc139341bb0fbf5fd7c-f1713866728od-w480_h360_x2.webp?w=1080&q=75"
