property_url,property_id,listing_id,mls,mls_id,status,text,style,full_street_line,street,unit,city,state,zip_code,beds,full_baths,half_baths,sqft,year_built,days_on_mls,list_price,list_price_min,list_price_max,list_date,sold_price,last_sold_date,assessed_value,estimated_value,tax,tax_history,new_construction,lot_sqft,price_per_sqft,latitude,longitude,neighborhoods,county,fips_code,stories,hoa_fee,parking_garage,agent_id,agent_name,agent_email,agent_phones,agent_mls_set,agent_nrds_id,broker_id,broker_name,builder_id,builder_name,office_id,office_mls_set,office_name,office_email,office_phones,nearby_schools,primary_photo,alt_photos
https://www.realtor.com/rentals/details/1667-Ensenada-Way_Aurora_CO_80011_M14515-15999,1451515999,2977462093,TRBO,865801,FOR_RENT,"Rent a beautifully furnished room in a 4-bedroom shared home! Convenient Location: Less than 5 miles from Anschutz Medical Campus & DIA. Amenities: Modern kitchen, in-unit laundry, cozy living room, queen-sized bed, flat-screen TV, ample closet space. Utilities Included: High-speed internet, all utilities covered in $825/month rent. Requirements: Background check, credit check, income verification. Security Deposit: $825 refundable. Lease Term: 3-month initial lease, extendable. No Pets Allowed. To apply, visit TurboTenant and search for Property ID 865801",SINGLE_FAMILY,1667 Ensenada Way,1667 Ensenada Way,,Aurora,CO,80011,1,1,,,,13,825,,,2025-01-21,429000,2022-01-06,22030,446100,2503,"[{'year': 2022, 'tax': 2503, 'assessment': {'building': 16680, 'land': 5350, 'total': 22030}}, {'year': 2021, 'tax': 2608, 'assessment': {'building': 17160, 'land': 5510, 'total': 22670}}, {'year': 2020, 'tax': 2615, 'assessment': {'building': 16650, 'land': 5510, 'total': 22160}}, {'year': 2019, 'tax': 2610, 'assessment': {'building': 16650, 'land': 5510, 'total': 22160}}, {'year': 2018, 'tax': 2123, 'assessment': {'building': 13490, 'land': 4460, 'total': 17950}}, {'year': 2017, 'tax': 1886, 'assessment': {'building': 13490, 'land': 4460, 'total': 17950}}, {'year': 2016, 'tax': 1446, 'assessment': {'building': 11260, 'land': 2390, 'total': 13650}}, {'year': 2015, 'tax': 1401, 'assessment': {'building': 11260, 'land': 2390, 'total': 13650}}, {'year': 2014, 'tax': 1081, 'assessment': {'building': 8300, 'land': 2070, 'total': 10370}}, {'year': 2013, 'tax': 1089, 'assessment': {'building': 8300, 'land': 2070, 'total': 10370}}, {'year': 2011, 'tax': 1000, 'assessment': {'building': 8700, 'land': 2150, 'total': 10850}}, {'year': 2010, 'tax': 961, 'assessment': {'building': 8700, 'land': 2150, 'total': 10850}}, {'year': 2009, 'tax': 954, 'assessment': {'building': 8700, 'land': 1750, 'total': 10450}}, {'year': 2007, 'tax': 1129, 'assessment': {'building': 10860, 'land': 2630, 'total': 13490}}]",False,,,39.743243,-104.760924,"Tower Triangle, Aurora East Village",Adams,08001,,,,,,,,,,,,,,,,,,,Adams-Arapahoe 28j School District,http://ap.rdcpix.com/24949ffeaeb43d3ae5d970ad0dea0e8fl-m1101186533od-w480_h360_x2.webp?w=1080&q=75,"http://ap.rdcpix.com/24949ffeaeb43d3ae5d970ad0dea0e8fl-m1101186533od-w480_h360_x2.webp?w=1080&q=75, http://ap.rdcpix.com/24949ffeaeb43d3ae5d970ad0dea0e8fl-m174893028od-w480_h360_x2.webp?w=1080&q=75, http://ap.rdcpix.com/24949ffeaeb43d3ae5d970ad0dea0e8fl-m3770828075od-w480_h360_x2.webp?w=1080&q=75, http://ap.rdcpix.com/24949ffeaeb43d3ae5d970ad0dea0e8fl-m3408871221od-w480_h360_x2.webp?w=1080&q=75, http://ap.rdcpix.com/24949ffeaeb43d3ae5d970ad0dea0e8fl-m3507759847od-w480_h360_x2.webp?w=1080&q=75, http://ap.rdcpix.com/24949ffeaeb43d3ae5d970ad0dea0e8fl-m3604637426od-w480_h360_x2.webp?w=1080&q=75, http://ap.rdcpix.com/24949ffeaeb43d3ae5d970ad0dea0e8fl-m2921580946od-w480_h360_x2.webp?w=1080&q=75, http://ap.rdcpix.com/24949ffeaeb43d3ae5d970ad0dea0e8fl-m1162174382od-w480_h360_x2.webp?w=1080&q=75, http://ap.rdcpix.com/24949ffeaeb43d3ae5d970ad0dea0e8fl-m3837730500od-w480_h360_x2.webp?w=1080&q=75, http://ap.rdcpix.com/24949ffeaeb43d3ae5d970ad0dea0e8fl-m2642987603od-w480_h360_x2.webp?w=1080&q=75, http://ap.rdcpix.com/24949ffeaeb43d3ae5d970ad0dea0e8fl-m1812886266od-w480_h360_x2.webp?w=1080&q=75"
https://www.realtor.com/rentals/details/1949-Alton-St_Aurora_CO_80010_M12572-82055,1257282055,2977781400,DVCO,6239643,FOR_RENT,"Text to schedule your showing! No Monthly Tenant Fees! Virtual tour: 1949 Alton St Location: Aurora Property Highlights: Enjoy being in the center of Aurora, Central Park, and Denver! Anschutz Medical Campus/VA and I-225 are just down the street, and it is only a 25-minute drive to DIA. This home has been updated with Stainless Steel appliances, central AC and a welcoming patio. and fully fenced yard. Utilities Included: None Tenant-Responsible Utilities: All utilities are paid by the tenant Bedrooms & Bathrooms Bedrooms: 3 Bathrooms: 1 Kitchen & Appliances Included Appliances: Stainless steel appliances! Stove, refrigerator, dishwasher, and garbage disposal Laundry: Washer and Dryer included! Interior Details Flooring: Vinyl Flooring Heating/Cooling: Central Heat and A/C Basement: N/A Exterior Details Parking: two car off-street driveway Fencing: Fully fenced backyard Restrictions & Pet Policy Pets are considered with a $35/month pet rent per pet Maximum of two No pit bulls or pit-mixes permitted An additional security deposit of $300 per pet Lease & Application Details Security Deposit: Equal to one month's rent Application Fee: $50 per adult Availability: Now! Applicants should be ready to start a lease within two weeks of the availability date Lease Term: Flexible lease terms Restrictions: No marijuana growing and no smoking inside the property Credit Requirement: Minimum credit score of 600 for non-subsidized housing applicants PMV/AI Real Estate Solutions License Number EC100031872",SINGLE_FAMILY,1949 Alton St,1949 Alton St,,Aurora,CO,80010,3,1,,1040,1945,4,2195,,,2025-01-30,195000,2019-04-11,19380,372400,2202,"[{'year': 2022, 'tax': 2202, 'assessment': {'building': 14030, 'land': 5350, 'total': 19380}}, {'year': 2021, 'tax': 2294, 'assessment': {'building': 14430, 'land': 5510, 'total': 19940}}, {'year': 2020, 'tax': 2189, 'assessment': {'building': 13040, 'land': 5510, 'total': 18550}}, {'year': 2019, 'tax': 2185, 'assessment': {'building': 13040, 'land': 5510, 'total': 18550}}, {'year': 2018, 'tax': 1644, 'assessment': {'building': 9580, 'land': 4320, 'total': 13900}}, {'year': 2017, 'tax': 1460, 'assessment': {'building': 9580, 'land': 4320, 'total': 13900}}, {'year': 2016, 'tax': 991, 'assessment': {'building': 7290, 'land': 2070, 'total': 9360}}, {'year': 2015, 'tax': 960, 'assessment': {'building': 7290, 'land': 2070, 'total': 9360}}, {'year': 2014, 'tax': 840, 'assessment': {'building': 6390, 'land': 1670, 'total': 8060}}, {'year': 2013, 'tax': 847, 'assessment': {'building': 6390, 'land': 1670, 'total': 8060}}, {'year': 2011, 'tax': 783, 'assessment': {'building': 6900, 'land': 1590, 'total': 8490}}, {'year': 2010, 'tax': 807, 'assessment': {'building': 6900, 'land': 1590, 'total': 8490}}, {'year': 2009, 'tax': 802, 'assessment': {'building': 6790, 'land': 1990, 'total': 8780}}, {'year': 2007, 'tax': 910, 'assessment': {'building': 8330, 'land': 2550, 'total': 10880}}]",False,,2,39.746563,-104.882598,Northwest Aurora,Adams,08001,1,0,,,Greg Weik,admin@resrents.com,"[{'ext': None, 'primary': True, 'type': None, 'number': '7207401055'}]",A-DVCO-21338569,,,,,,,O-DVCO-M1814,Real Estate Solutions,home@resdenver.net,"[{'number': '(303) 586-5560', 'type': 'Office', 'primary': True, 'ext': None}]","Charter School Institute School District, Adams-Arapahoe 28j School District",http://ap.rdcpix.com/416ef62d4ec55b6947bbabb8723b1ac4l-m3788347249od-w480_h360_x2.webp?w=1080&q=75,"http://ap.rdcpix.com/416ef62d4ec55b6947bbabb8723b1ac4l-m3788347249od-w480_h360_x2.webp?w=1080&q=75, http://ap.rdcpix.com/416ef62d4ec55b6947bbabb8723b1ac4l-m157935598od-w480_h360_x2.webp?w=1080&q=75, http://ap.rdcpix.com/416ef62d4ec55b6947bbabb8723b1ac4l-m3801632937od-w480_h360_x2.webp?w=1080&q=75, http://ap.rdcpix.com/416ef62d4ec55b6947bbabb8723b1ac4l-m51455684od-w480_h360_x2.webp?w=1080&q=75, http://ap.rdcpix.com/416ef62d4ec55b6947bbabb8723b1ac4l-m3490661936od-w480_h360_x2.webp?w=1080&q=75, http://ap.rdcpix.com/416ef62d4ec55b6947bbabb8723b1ac4l-m2774327626od-w480_h360_x2.webp?w=1080&q=75, http://ap.rdcpix.com/416ef62d4ec55b6947bbabb8723b1ac4l-m2641830546od-w480_h360_x2.webp?w=1080&q=75, http://ap.rdcpix.com/416ef62d4ec55b6947bbabb8723b1ac4l-m3601302508od-w480_h360_x2.webp?w=1080&q=75, http://ap.rdcpix.com/416ef62d4ec55b6947bbabb8723b1ac4l-m2379816411od-w480_h360_x2.webp?w=1080&q=75, http://ap.rdcpix.com/416ef62d4ec55b6947bbabb8723b1ac4l-m1428182814od-w480_h360_x2.webp?w=1080&q=75, http://ap.rdcpix.com/416ef62d4ec55b6947bbabb8723b1ac4l-m1440948574od-w480_h360_x2.webp?w=1080&q=75, http://ap.rdcpix.com/416ef62d4ec55b6947bbabb8723b1ac4l-m3290363075od-w480_h360_x2.webp?w=1080&q=75"
https://www.realtor.com/rentals/details/19698-E-Lasalle-Dr_Aurora_CO_80013_M14665-73886,1466573886,2977834040,DVCO,3905247,FOR_RENT,"This cozy 3-bedroom, 2-bathroom home is located in a vibrant neighborhood in Southeast Aurora, offering a perfect balance of comfort and convenience. Inside, youll find a spacious living area, a well-equipped kitchen, and a private backyard ideal for relaxing or entertaining. The primary bedroom includes an ensuite bathroom, and theres plenty of storage space throughout the home. Key Features: 3 Bedrooms, 2 Bathrooms Private backyard 2-Car Garage Bright and open living space with vaulted ceilings and gas fireplace Things to Do in the Area: Cherry Creek State Park: Just a short drive away, this beautiful park offers hiking, biking, fishing, and picnickingperfect for outdoor enthusiasts. Southlands Mall: Less than 10 minutes away, enjoy shopping, dining, and entertainment at one of Auroras most popular malls. Aurora Reservoir: A scenic spot for fishing, boating, and trails, ideal for a peaceful day outdoors. Golfing: Several golf courses nearby, including Saddle Rock Golf Course and the Aurora Hills Golf Course, perfect for golf lovers. Dining and Entertainment: From local restaurants to movie theaters, the area offers plenty of options for a night out or casual dining. With easy access to parks, shopping, and dining, this home is perfectly situated to enjoy all that Aurora has to offer. Available for rent now! Contact to schedule a showing.",SINGLE_FAMILY,19698 E Lasalle Dr,19698 E Lasalle Dr,,Aurora,CO,80013,3,3,,1386,1999,3,2650,,,2025-01-31,280000,2017-01-20,24367,470300,2446,"[{'year': 2022, 'tax': 2446, 'assessment': {'building': 15985, 'land': 8382, 'total': 24367}}, {'year': 2021, 'tax': 2525, 'assessment': {'building': 16445, 'land': 8623, 'total': 25068}}, {'year': 2020, 'tax': 2473, 'assessment': {'building': 15129, 'land': 8623, 'total': 23752}}, {'year': 2019, 'tax': 2626, 'assessment': {'building': 15129, 'land': 8623, 'total': 23752}}, {'year': 2018, 'tax': 2385, 'assessment': {'building': 14918, 'land': 4680, 'total': 19598}}, {'year': 2017, 'tax': 2116, 'assessment': {'building': 14918, 'land': 4680, 'total': 19598}}, {'year': 2016, 'tax': 1827, 'assessment': {'building': 13397, 'land': 2786, 'total': 16183}}, {'year': 2015, 'tax': 1775, 'assessment': {'building': 13397, 'land': 2786, 'total': 16183}}, {'year': 2014, 'tax': 1320, 'assessment': {'building': 8485, 'land': 2786, 'total': 11271}}, {'year': 2013, 'tax': 1334, 'assessment': {'building': 8485, 'land': 2786, 'total': 11271}}, {'year': 2012, 'tax': 1488, 'assessment': {'building': None, 'land': None, 'total': 12950}}, {'year': 2010, 'tax': 1222, 'assessment': {'building': None, 'land': None, 'total': 12950}}, {'year': 2008, 'tax': 1525, 'assessment': {'building': 9360, 'land': 2390, 'total': 11750}}, {'year': 2007, 'tax': 1400, 'assessment': {'building': 13080, 'land': 2390, 'total': 15470}}]",False,5663,2,39.668933,-104.759454,Sterling Hills,Arapahoe,08005,2,0,2,126530,Jeff Kroll,jeff@coloradodreamhomes.net,"[{'ext': None, 'primary': True, 'type': 'Mobile', 'number': '3037171492'}, {'ext': '650', 'primary': True, 'type': 'Toll Free', 'number': '8665328524'}, {'ext': '650', 'primary': True, 'type': 'Office', 'number': '3038410800'}]",A-DVCO-21344190,220500860,1900163,Mb Colorado Dream Properties -  Broker,,,817065,O-DVCO-DREAM,COLORADO DREAM PROPERTIES,info@coloradodreamhomes.net,"[{'number': '3038410800', 'type': 'Office', 'primary': True, 'ext': None}, {'number': '8665328524', 'type': 'Toll Free', 'primary': True, 'ext': None}]",Adams-Arapahoe 28j School District,http://ap.rdcpix.com/06a87da5338c1284c76c9f1e119adb03l-m2709636423od-w480_h360_x2.webp?w=1080&q=75,"http://ap.rdcpix.com/06a87da5338c1284c76c9f1e119adb03l-m2709636423od-w480_h360_x2.webp?w=1080&q=75, http://ap.rdcpix.com/06a87da5338c1284c76c9f1e119adb03l-m144133374od-w480_h360_x2.webp?w=1080&q=75, http://ap.rdcpix.com/06a87da5338c1284c76c9f1e119adb03l-m3059608216od-w480_h360_x2.webp?w=1080&q=75, http://ap.rdcpix.com/06a87da5338c1284c76c9f1e119adb03l-m80845508od-w480_h360_x2.webp?w=1080&q=75, http://ap.rdcpix.com/06a87da5338c1284c76c9f1e119adb03l-m1142606360od-w480_h360_x2.webp?w=1080&q=75, http://ap.rdcpix.com/06a87da5338c1284c76c9f1e119adb03l-m1861239340od-w480_h360_x2.webp?w=1080&q=75, http://ap.rdcpix.com/06a87da5338c1284c76c9f1e119adb03l-m3762877257od-w480_h360_x2.webp?w=1080&q=75, http://ap.rdcpix.com/06a87da5338c1284c76c9f1e119adb03l-m2326023858od-w480_h360_x2.webp?w=1080&q=75, http://ap.rdcpix.com/06a87da5338c1284c76c9f1e119adb03l-m2697758953od-w480_h360_x2.webp?w=1080&q=75, http://ap.rdcpix.com/06a87da5338c1284c76c9f1e119adb03l-m1397749434od-w480_h360_x2.webp?w=1080&q=75, http://ap.rdcpix.com/06a87da5338c1284c76c9f1e119adb03l-m3456891343od-w480_h360_x2.webp?w=1080&q=75, http://ap.rdcpix.com/06a87da5338c1284c76c9f1e119adb03l-m665136010od-w480_h360_x2.webp?w=1080&q=75, http://ap.rdcpix.com/06a87da5338c1284c76c9f1e119adb03l-m161688674od-w480_h360_x2.webp?w=1080&q=75, http://ap.rdcpix.com/06a87da5338c1284c76c9f1e119adb03l-m3561587489od-w480_h360_x2.webp?w=1080&q=75, http://ap.rdcpix.com/06a87da5338c1284c76c9f1e119adb03l-m3400440978od-w480_h360_x2.webp?w=1080&q=75, http://ap.rdcpix.com/06a87da5338c1284c76c9f1e119adb03l-m2711473857od-w480_h360_x2.webp?w=1080&q=75, http://ap.rdcpix.com/06a87da5338c1284c76c9f1e119adb03l-m1771850332od-w480_h360_x2.webp?w=1080&q=75, http://ap.rdcpix.com/06a87da5338c1284c76c9f1e119adb03l-m1443100611od-w480_h360_x2.webp?w=1080&q=75"
https://www.realtor.com/rentals/details/16344-E-Carolina-Dr_Aurora_CO_80017_M25626-84053,2562684053,2977619625,DVCO,8488395,FOR_RENT,"Rare opportunity to own this Newly renovated 4 bedroom, 2 bath home. Centrally located in Aurora. Spacious Huge backyard, Home has natural shining solid hardwood floors, granite counter tops in kitchen, quartz counter tops in the bathroom, 2 Natural wood Fireplaces. Home has open floor plan, new windows, newer roof, new Kitchen and bathroom cabinets, Hunter Douglas window coverings and Spacious Patio that can be accessed from the Kitchen and the Master Bedroom. Don't miss out on this Great Opportunity.",SINGLE_FAMILY,16344 E Carolina Dr,16344 E Carolina Dr,,Aurora,CO,80017,4,2,,1753,1980,8,3000,,,2025-01-26,173000,2005-09-01,22901,445000,2299,"[{'year': 2022, 'tax': 2299, 'assessment': {'building': 16576, 'land': 6325, 'total': 22901}}, {'year': 2021, 'tax': 2373, 'assessment': {'building': 17053, 'land': 6507, 'total': 23560}}, {'year': 2020, 'tax': 2353, 'assessment': {'building': 16095, 'land': 6507, 'total': 22602}}, {'year': 2019, 'tax': 2340, 'assessment': {'building': 16095, 'land': 6507, 'total': 22602}}, {'year': 2018, 'tax': 1980, 'assessment': {'building': 14767, 'land': 3960, 'total': 18727}}, {'year': 2017, 'tax': 1722, 'assessment': {'building': 14767, 'land': 3960, 'total': 18727}}, {'year': 2016, 'tax': 1414, 'assessment': {'building': 11478, 'land': 3582, 'total': 15060}}, {'year': 2015, 'tax': 1365, 'assessment': {'building': 11478, 'land': 3582, 'total': 15060}}, {'year': 2014, 'tax': 1043, 'assessment': {'building': 8692, 'land': 2388, 'total': 11080}}, {'year': 2013, 'tax': 1057, 'assessment': {'building': 8692, 'land': 2388, 'total': 11080}}, {'year': 2012, 'tax': 1193, 'assessment': {'building': None, 'land': None, 'total': 12980}}, {'year': 2010, 'tax': 863, 'assessment': {'building': None, 'land': None, 'total': 12980}}, {'year': 2008, 'tax': 1189, 'assessment': {'building': 8260, 'land': 2390, 'total': 10650}}, {'year': 2007, 'tax': 1069, 'assessment': {'building': 12460, 'land': 2390, 'total': 14850}}]",False,6316,2,39.689479,-104.797565,"Rocky Ridge, Kingsborough Knolls",Arapahoe,08005,2,0,2,921678,Blessed Barrack,blessedblessed31@gmail.com,"[{'ext': None, 'primary': True, 'type': 'Mobile', 'number': '7206283623'}]",A-DVCO-21341899,232013551,3916046,EQUITY COLORADO REAL ESTATE,,,1462611,O-DVCO-EQTCO,Equity Colorado Real Estate,Todd@equitycolorado.net,"[{'number': '7207223209', 'type': 'Office', 'primary': True, 'ext': None}]","Charter School Institute School District, Adams-Arapahoe 28j School District",http://ap.rdcpix.com/e7f52ec2f2d41ad6b8dfb0fb2c82e8a5l-m1283844030od-w480_h360_x2.webp?w=1080&q=75,"http://ap.rdcpix.com/e7f52ec2f2d41ad6b8dfb0fb2c82e8a5l-m1283844030od-w480_h360_x2.webp?w=1080&q=75, http://ap.rdcpix.com/e7f52ec2f2d41ad6b8dfb0fb2c82e8a5l-m2535380207od-w480_h360_x2.webp?w=1080&q=75, http://ap.rdcpix.com/e7f52ec2f2d41ad6b8dfb0fb2c82e8a5l-m1227955443od-w480_h360_x2.webp?w=1080&q=75, http://ap.rdcpix.com/e7f52ec2f2d41ad6b8dfb0fb2c82e8a5l-m3891872743od-w480_h360_x2.webp?w=1080&q=75, http://ap.rdcpix.com/e7f52ec2f2d41ad6b8dfb0fb2c82e8a5l-m1656447246od-w480_h360_x2.webp?w=1080&q=75, http://ap.rdcpix.com/e7f52ec2f2d41ad6b8dfb0fb2c82e8a5l-m691535729od-w480_h360_x2.webp?w=1080&q=75, http://ap.rdcpix.com/e7f52ec2f2d41ad6b8dfb0fb2c82e8a5l-m3837781937od-w480_h360_x2.webp?w=1080&q=75, http://ap.rdcpix.com/e7f52ec2f2d41ad6b8dfb0fb2c82e8a5l-m1130236645od-w480_h360_x2.webp?w=1080&q=75, http://ap.rdcpix.com/e7f52ec2f2d41ad6b8dfb0fb2c82e8a5l-m3440727475od-w480_h360_x2.webp?w=1080&q=75, http://ap.rdcpix.com/e7f52ec2f2d41ad6b8dfb0fb2c82e8a5l-m3755645556od-w480_h360_x2.webp?w=1080&q=75, http://ap.rdcpix.com/e7f52ec2f2d41ad6b8dfb0fb2c82e8a5l-m2186515885od-w480_h360_x2.webp?w=1080&q=75, http://ap.rdcpix.com/e7f52ec2f2d41ad6b8dfb0fb2c82e8a5l-m2218381113od-w480_h360_x2.webp?w=1080&q=75, http://ap.rdcpix.com/e7f52ec2f2d41ad6b8dfb0fb2c82e8a5l-m2700813829od-w480_h360_x2.webp?w=1080&q=75, http://ap.rdcpix.com/e7f52ec2f2d41ad6b8dfb0fb2c82e8a5l-m2020965983od-w480_h360_x2.webp?w=1080&q=75, http://ap.rdcpix.com/e7f52ec2f2d41ad6b8dfb0fb2c82e8a5l-m1137970642od-w480_h360_x2.webp?w=1080&q=75, http://ap.rdcpix.com/e7f52ec2f2d41ad6b8dfb0fb2c82e8a5l-m103446458od-w480_h360_x2.webp?w=1080&q=75"
https://www.realtor.com/rentals/details/6212-S-Valdai-Ct_Aurora_CO_80015_M10413-67189,1041367189,2977690489,AVAL,61271627,FOR_RENT,"Gorgeous 2-story home in an amazing location with 5 bedrooms and 3.5 baths. Adjacent to a greenbelt in Saddle Rock Ridge- The Vista, with access to walking and biking trails. Stunning and open floor plan great for entertaining. Entry/living room with vaulted ceiling and an elegant elevated formal dining room and kitchen with refinished hardwood floors and newer appliances. The family room has 10ft ceilings, a cozy fireplace, and is open to the spacious kitchen and breakfast nook. Upper-level boasts a huge master retreat with a fireplace, two separate walk-in closets and a luxurious, newly remodeled 5-piece master bath. Completing the upstairs are 3 bedrooms, one with a balcony and incredible view of Downtown Denver and the entire Front Range, and a newly remodeled bathroom. Also has a fully-finished basement and basement bathroom for guests or an office. Additional amenities include a 3-car attached garage, central a/c with eco-friendly Nest thermostat, large private backyard deck and patio, and a large front porch. The private backyard is adjacent to a huge greenbelt which provides access to biking and walking trails. Enjoy the beautiful mountain views and colorful Colorado sunsets from either the large covered front porch, or from the second-floor balcony. 30 minutes from DIA, and Buckley is a quick commute. Southlands shopping and access to E-470 are less than 5-minutes away. Offering a monthly rental discount for military.",SINGLE_FAMILY,6212 S Valdai Ct,6212 S Valdai Ct,,Aurora,CO,80015,5,3,,3000,,6,3830,,,2025-01-28,455000,2018-04-05,32838,654200,3798,"[{'year': 2022, 'tax': 3798, 'assessment': {'building': 22059, 'land': 10779, 'total': 32838}}, {'year': 2021, 'tax': 3826, 'assessment': {'building': 22694, 'land': 11090, 'total': 33784}}, {'year': 2020, 'tax': 3725, 'assessment': {'building': 24789, 'land': 7865, 'total': 32654}}, {'year': 2019, 'tax': 3615, 'assessment': {'building': 24789, 'land': 7865, 'total': 32654}}, {'year': 2018, 'tax': 3594, 'assessment': {'building': 24134, 'land': 5400, 'total': 29534}}, {'year': 2017, 'tax': 3543, 'assessment': {'building': 24134, 'land': 5400, 'total': 29534}}, {'year': 2016, 'tax': 3264, 'assessment': {'building': 21978, 'land': 3980, 'total': 25958}}, {'year': 2015, 'tax': 3166, 'assessment': {'building': 21978, 'land': 3980, 'total': 25958}}, {'year': 2014, 'tax': 2793, 'assessment': {'building': 17090, 'land': 3980, 'total': 21070}}, {'year': 2013, 'tax': 2817, 'assessment': {'building': 17090, 'land': 3980, 'total': 21070}}, {'year': 2012, 'tax': 2941, 'assessment': {'building': None, 'land': None, 'total': 21940}}, {'year': 2010, 'tax': 2929, 'assessment': {'building': None, 'land': None, 'total': 21940}}, {'year': 2008, 'tax': 3020, 'assessment': {'building': 19530, 'land': 3980, 'total': 23510}}, {'year': 2007, 'tax': 2958, 'assessment': {'building': 20900, 'land': 3980, 'total': 24880}}]",False,,1,39.604423,-104.723375,Saddle Rock Ridge,Arapahoe,08005,,,,,,,,,,,,,,,,,,,Cherry Creek 5 School District,http://ap.rdcpix.com/36617a0961922c00ca802e83e05a9e18l-m4055548269od-w480_h360_x2.webp?w=1080&q=75,"http://ap.rdcpix.com/36617a0961922c00ca802e83e05a9e18l-m4055548269od-w480_h360_x2.webp?w=1080&q=75, http://ap.rdcpix.com/36617a0961922c00ca802e83e05a9e18l-m795445434od-w480_h360_x2.webp?w=1080&q=75, http://ap.rdcpix.com/36617a0961922c00ca802e83e05a9e18l-m1940398290od-w480_h360_x2.webp?w=1080&q=75, http://ap.rdcpix.com/36617a0961922c00ca802e83e05a9e18l-m1981321913od-w480_h360_x2.webp?w=1080&q=75, http://ap.rdcpix.com/36617a0961922c00ca802e83e05a9e18l-m3285957155od-w480_h360_x2.webp?w=1080&q=75, http://ap.rdcpix.com/36617a0961922c00ca802e83e05a9e18l-m2021428003od-w480_h360_x2.webp?w=1080&q=75, http://ap.rdcpix.com/36617a0961922c00ca802e83e05a9e18l-m2784002943od-w480_h360_x2.webp?w=1080&q=75, http://ap.rdcpix.com/36617a0961922c00ca802e83e05a9e18l-m487445723od-w480_h360_x2.webp?w=1080&q=75, http://ap.rdcpix.com/36617a0961922c00ca802e83e05a9e18l-m41020470od-w480_h360_x2.webp?w=1080&q=75, http://ap.rdcpix.com/36617a0961922c00ca802e83e05a9e18l-m930911471od-w480_h360_x2.webp?w=1080&q=75, http://ap.rdcpix.com/36617a0961922c00ca802e83e05a9e18l-m2470978941od-w480_h360_x2.webp?w=1080&q=75, http://ap.rdcpix.com/36617a0961922c00ca802e83e05a9e18l-m1862119223od-w480_h360_x2.webp?w=1080&q=75, http://ap.rdcpix.com/36617a0961922c00ca802e83e05a9e18l-m84038304od-w480_h360_x2.webp?w=1080&q=75, http://ap.rdcpix.com/36617a0961922c00ca802e83e05a9e18l-m1769350147od-w480_h360_x2.webp?w=1080&q=75, http://ap.rdcpix.com/36617a0961922c00ca802e83e05a9e18l-m80179809od-w480_h360_x2.webp?w=1080&q=75, http://ap.rdcpix.com/36617a0961922c00ca802e83e05a9e18l-m3741544356od-w480_h360_x2.webp?w=1080&q=75, http://ap.rdcpix.com/36617a0961922c00ca802e83e05a9e18l-m3513215543od-w480_h360_x2.webp?w=1080&q=75, http://ap.rdcpix.com/36617a0961922c00ca802e83e05a9e18l-m3769924716od-w480_h360_x2.webp?w=1080&q=75, http://ap.rdcpix.com/36617a0961922c00ca802e83e05a9e18l-m3104977062od-w480_h360_x2.webp?w=1080&q=75, http://ap.rdcpix.com/36617a0961922c00ca802e83e05a9e18l-m125546282od-w480_h360_x2.webp?w=1080&q=75, http://ap.rdcpix.com/36617a0961922c00ca802e83e05a9e18l-m2539205675od-w480_h360_x2.webp?w=1080&q=75, http://ap.rdcpix.com/36617a0961922c00ca802e83e05a9e18l-m3195543802od-w480_h360_x2.webp?w=1080&q=75, http://ap.rdcpix.com/36617a0961922c00ca802e83e05a9e18l-m1832908946od-w480_h360_x2.webp?w=1080&q=75, http://ap.rdcpix.com/36617a0961922c00ca802e83e05a9e18l-m1497734356od-w480_h360_x2.webp?w=1080&q=75, http://ap.rdcpix.com/36617a0961922c00ca802e83e05a9e18l-m1054698536od-w480_h360_x2.webp?w=1080&q=75, http://ap.rdcpix.com/36617a0961922c00ca802e83e05a9e18l-m2972767961od-w480_h360_x2.webp?w=1080&q=75, http://ap.rdcpix.com/36617a0961922c00ca802e83e05a9e18l-m2256281982od-w480_h360_x2.webp?w=1080&q=75, http://ap.rdcpix.com/36617a0961922c00ca802e83e05a9e18l-m4248039223od-w480_h360_x2.webp?w=1080&q=75"
