property_url,property_id,listing_id,mls,mls_id,status,text,style,full_street_line,street,unit,city,state,zip_code,beds,full_baths,half_baths,sqft,year_built,days_on_mls,list_price,list_price_min,list_price_max,list_date,sold_price,last_sold_date,assessed_value,estimated_value,tax,tax_history,new_construction,lot_sqft,price_per_sqft,latitude,longitude,neighborhoods,county,fips_code,stories,hoa_fee,parking_garage,agent_id,agent_name,agent_email,agent_phones,agent_mls_set,agent_nrds_id,broker_id,broker_name,builder_id,builder_name,office_id,office_mls_set,office_name,office_email,office_phones,nearby_schools,primary_photo,alt_photos
https://www.realtor.com/realestateandhomes-detail/3421-W-131st-Ave_Broomfield_CO_80020_M10868-70127,1086870127,2977510060,DVCO,5927250,PENDING,"Welcome to 3421 W 131st Avenue! This updated 4 bedroom, 3 bath home is the epitome of modern living. Located within Adams 12 5 star school district. It exudes comfort and style, with no detail overlooked. As you enter through the front door, you will be greeted by large windows and abundant natural light, reflecting designer touches. The open concept creates an inviting ambiance for a harmonious flow between the spacious living area, fully remodeled open kitchen, and dining room. The upper level features two bedrooms with a full bathroom. An additional bedroom and a bathroom on the lower level provide versatility and convenience. The cozy family room boasts a beautiful fireplace and perfect space for family time. There is an additional bedroom and a bath in the basement. Recent renovation includes newer systems (HVAC, water heater) flooring, paint, doors and trim, kitchen and bathrooms with beautiful new cabinetry, quartz countertops, porcelain tile, and SS appliances. The large Tuff Shed is 20 x 12 and can be used for all your toys with side gate access. Walking distance to Paul Derda Recreation Center, Broomfield Open Space, Broomfield Commons, scenic walking paths, and various shopping and dining options, this home offers convenience at your doorstep. The home reflects a harmonious blend of style, convenience, and lifestyle in a beautiful and family friendly neighborhood.",SINGLE_FAMILY,3421 W 131st Ave,3421 W 131st Ave,,Broomfield,CO,80020,4,2,,1852,1973,11,630000,,,2025-01-23,450000,2024-09-25,25400,450400,2084,"[{'year': 2022, 'tax': 2084, 'assessment': {'building': 19630, 'land': 5770, 'total': 25400}}, {'year': 2021, 'tax': 2147, 'assessment': {'building': 20190, 'land': 5930, 'total': 26120}}, {'year': 2020, 'tax': 2011, 'assessment': {'building': 19210, 'land': 5510, 'total': 24720}}, {'year': 2019, 'tax': 2012, 'assessment': {'building': 19210, 'land': 5510, 'total': 24720}}, {'year': 2018, 'tax': 1411, 'assessment': {'building': 14960, 'land': 4210, 'total': 19170}}, {'year': 2017, 'tax': 1286, 'assessment': {'building': 14960, 'land': 4210, 'total': 19170}}, {'year': 2016, 'tax': 1153, 'assessment': {'building': 13760, 'land': 4660, 'total': 18420}}, {'year': 2015, 'tax': 1153, 'assessment': {'building': 13760, 'land': 4660, 'total': 18420}}, {'year': 2014, 'tax': 1631, 'assessment': {'building': 9740, 'land': 4660, 'total': 14400}}, {'year': 2013, 'tax': 787, 'assessment': {'building': 9740, 'land': 4660, 'total': 14400}}, {'year': 2011, 'tax': 1418, 'assessment': {'building': 8120, 'land': 4660, 'total': 12780}}, {'year': 2010, 'tax': 1680, 'assessment': {'building': 8120, 'land': 4660, 'total': 12780}}, {'year': 2009, 'tax': 1678, 'assessment': {'building': 10470, 'land': 4660, 'total': 15130}}, {'year': 2008, 'tax': 913, 'assessment': {'building': 11570, 'land': 4660, 'total': 16230}}, {'year': 2007, 'tax': 871, 'assessment': {'building': 11570, 'land': 4660, 'total': 16230}}]",False,8000,340,39.933412,-105.032504,Westlake Village,Broomfield,08014,2,0,2,4794015,Asmir Mujezin,amujezin@comcast.net,"[{'ext': None, 'primary': True, 'type': 'BUSINESS_MOBILE', 'number': '7202263098'}]",A-DVCO-2025223934,,1188640,Keller Williams Realty Downtown,,,2156363,O-DVCO-KW002,Keller Williams Realty Downtown,tdaily@kw.com,"[{'number': '3035395700', 'type': 'Office', 'primary': True, 'ext': None}]","Charter School Institute School District, Adams 12 Five Star Schools School District",http://ap.rdcpix.com/609c2ae2a02dddd8ad3930b8e301f3b9l-m1206402132od-w480_h360_x2.webp?w=1080&q=75,"http://ap.rdcpix.com/609c2ae2a02dddd8ad3930b8e301f3b9l-m1206402132od-w480_h360_x2.webp?w=1080&q=75, http://ap.rdcpix.com/609c2ae2a02dddd8ad3930b8e301f3b9l-m1376617214od-w480_h360_x2.webp?w=1080&q=75, http://ap.rdcpix.com/609c2ae2a02dddd8ad3930b8e301f3b9l-m2679633490od-w480_h360_x2.webp?w=1080&q=75, http://ap.rdcpix.com/609c2ae2a02dddd8ad3930b8e301f3b9l-m4007262082od-w480_h360_x2.webp?w=1080&q=75, http://ap.rdcpix.com/609c2ae2a02dddd8ad3930b8e301f3b9l-m389113853od-w480_h360_x2.webp?w=1080&q=75, http://ap.rdcpix.com/609c2ae2a02dddd8ad3930b8e301f3b9l-m4263880951od-w480_h360_x2.webp?w=1080&q=75, http://ap.rdcpix.com/609c2ae2a02dddd8ad3930b8e301f3b9l-m2177926812od-w480_h360_x2.webp?w=1080&q=75, http://ap.rdcpix.com/609c2ae2a02dddd8ad3930b8e301f3b9l-m577555230od-w480_h360_x2.webp?w=1080&q=75, http://ap.rdcpix.com/609c2ae2a02dddd8ad3930b8e301f3b9l-m4011493905od-w480_h360_x2.webp?w=1080&q=75, http://ap.rdcpix.com/609c2ae2a02dddd8ad3930b8e301f3b9l-m3108838816od-w480_h360_x2.webp?w=1080&q=75, http://ap.rdcpix.com/609c2ae2a02dddd8ad3930b8e301f3b9l-m486747204od-w480_h360_x2.webp?w=1080&q=75, http://ap.rdcpix.com/609c2ae2a02dddd8ad3930b8e301f3b9l-m557936574od-w480_h360_x2.webp?w=1080&q=75, http://ap.rdcpix.com/609c2ae2a02dddd8ad3930b8e301f3b9l-m1142068891od-w480_h360_x2.webp?w=1080&q=75, http://ap.rdcpix.com/609c2ae2a02dddd8ad3930b8e301f3b9l-m3460213248od-w480_h360_x2.webp?w=1080&q=75, http://ap.rdcpix.com/609c2ae2a02dddd8ad3930b8e301f3b9l-m2787648061od-w480_h360_x2.webp?w=1080&q=75, http://ap.rdcpix.com/609c2ae2a02dddd8ad3930b8e301f3b9l-m45726359od-w480_h360_x2.webp?w=1080&q=75, http://ap.rdcpix.com/609c2ae2a02dddd8ad3930b8e301f3b9l-m2688090564od-w480_h360_x2.webp?w=1080&q=75, http://ap.rdcpix.com/609c2ae2a02dddd8ad3930b8e301f3b9l-m487159693od-w480_h360_x2.webp?w=1080&q=75, http://ap.rdcpix.com/609c2ae2a02dddd8ad3930b8e301f3b9l-m2571464373od-w480_h360_x2.webp?w=1080&q=75, http://ap.rdcpix.com/609c2ae2a02dddd8ad3930b8e301f3b9l-m4256133551od-w480_h360_x2.webp?w=1080&q=75, http://ap.rdcpix.com/609c2ae2a02dddd8ad3930b8e301f3b9l-m239962105od-w480_h360_x2.webp?w=1080&q=75, http://ap.rdcpix.com/609c2ae2a02dddd8ad3930b8e301f3b9l-m3090492893od-w480_h360_x2.webp?w=1080&q=75, http://ap.rdcpix.com/609c2ae2a02dddd8ad3930b8e301f3b9l-m3725480127od-w480_h360_x2.webp?w=1080&q=75, http://ap.rdcpix.com/609c2ae2a02dddd8ad3930b8e301f3b9l-m1658585049od-w480_h360_x2.webp?w=1080&q=75, http://ap.rdcpix.com/609c2ae2a02dddd8ad3930b8e301f3b9l-m3235067861od-w480_h360_x2.webp?w=1080&q=75, http://ap.rdcpix.com/609c2ae2a02dddd8ad3930b8e301f3b9l-m1961728326od-w480_h360_x2.webp?w=1080&q=75, http://ap.rdcpix.com/609c2ae2a02dddd8ad3930b8e301f3b9l-m1158513338od-w480_h360_x2.webp?w=1080&q=75, http://ap.rdcpix.com/609c2ae2a02dddd8ad3930b8e301f3b9l-m3168097324od-w480_h360_x2.webp?w=1080&q=75, http://ap.rdcpix.com/609c2ae2a02dddd8ad3930b8e301f3b9l-m507899352od-w480_h360_x2.webp?w=1080&q=75"
https://www.realtor.com/realestateandhomes-detail/16546-Umatilla-Pl_Broomfield_CO_80023_M90686-51181,9068651181,2977510901,DVCO,5512379,FOR_SALE,"This stunning home boasts one of the best lots in the Baseline community, offering breathtaking views overlooking the park, from Pikes Peak to the plains. This residence features a spacious floor plan, custom finishes, 3 levels of patio outdoor living- and did we mention it's adjacent to a neighborhood park. The main level has a mudroom bench seats, and 2 bedrooms(one is currently configured as an office)and bath. Plenty of natural light makes the spaces inviting. Upstairs main level is perfect for entertaining, with an open concept living area, beautiful stonework at the fire place, a large granite island and granite counters. The gourmet kitchen is equipped with stainless steel appliances, a walk-in pantry, custom window coverings, and gorgeous light fixtures. On the same level, you'll find a luxurious primary suite with double sinks, large walk-in shower and dual walk-in closets, and a laundry room. The top floor is an entertainer's dream, with a game room that opens onto a covered deck with panoramic views. This space is perfect for watching sunsets, hosting game nights, or simply relaxing and enjoying the Colorado weather. This floor also showcases a bathroom with a free standing soaking tub. Located steps from Checker Square and the neighborhood park, this home offers a true sense of community. With miles of walking paths, parks, and green space, Baseline is the perfect place to call home. Plus, enjoy the ease of living on a low maintenance cottage garden lot, proximity to guest parking, and easy access to shopping areas Don't miss out on this incredible opportunity to live in one of the most desirable communities in Colorado. Schedule a showing today!",SINGLE_FAMILY,16546 Umatilla Pl,16546 Umatilla Pl,,Broomfield,CO,80023,3,3,1,2449,2021,11,785000,,,2025-01-23,671389,2021-10-29,45200,767000,7441,"[{'year': 2022, 'tax': 7441, 'assessment': {'building': 38010, 'land': 7190, 'total': 45200}}, {'year': 2021, 'tax': 2459, 'assessment': {'building': None, 'land': 15050, 'total': 15050}}, {'year': 2020, 'tax': 332, 'assessment': {'building': None, 'land': 2020, 'total': 2020}}]",False,2730,321,39.994857,-105.012841,Baseline,Broomfield,08014,3,76,2,2228685,Sydney Sowy,,,A-DVCO-366221901,,,,,,,O-DVCO-M3743,Help-U-Sell Front Range,sydney@hushillcountry.com,"[{'number': '(210) 788-9633', 'type': 'Mobile', 'primary': True, 'ext': None}]",Adams 12 Five Star Schools School District,http://ap.rdcpix.com/fcd6aaad385eb1abf1984798f998c72el-m2115928747od-w480_h360_x2.webp?w=1080&q=75,"http://ap.rdcpix.com/fcd6aaad385eb1abf1984798f998c72el-m2115928747od-w480_h360_x2.webp?w=1080&q=75, http://ap.rdcpix.com/fcd6aaad385eb1abf1984798f998c72el-m4121208697od-w480_h360_x2.webp?w=1080&q=75, http://ap.rdcpix.com/fcd6aaad385eb1abf1984798f998c72el-m1252351012od-w480_h360_x2.webp?w=1080&q=75, http://ap.rdcpix.com/fcd6aaad385eb1abf1984798f998c72el-m1796146446od-w480_h360_x2.webp?w=1080&q=75, http://ap.rdcpix.com/fcd6aaad385eb1abf1984798f998c72el-m2768278088od-w480_h360_x2.webp?w=1080&q=75, http://ap.rdcpix.com/fcd6aaad385eb1abf1984798f998c72el-m1396648331od-w480_h360_x2.webp?w=1080&q=75, http://ap.rdcpix.com/fcd6aaad385eb1abf1984798f998c72el-m2056692606od-w480_h360_x2.webp?w=1080&q=75, http://ap.rdcpix.com/fcd6aaad385eb1abf1984798f998c72el-m652983940od-w480_h360_x2.webp?w=1080&q=75, http://ap.rdcpix.com/fcd6aaad385eb1abf1984798f998c72el-m2382726379od-w480_h360_x2.webp?w=1080&q=75, http://ap.rdcpix.com/fcd6aaad385eb1abf1984798f998c72el-m2013764140od-w480_h360_x2.webp?w=1080&q=75, http://ap.rdcpix.com/fcd6aaad385eb1abf1984798f998c72el-m3038654453od-w480_h360_x2.webp?w=1080&q=75, http://ap.rdcpix.com/fcd6aaad385eb1abf1984798f998c72el-m1988572174od-w480_h360_x2.webp?w=1080&q=75, http://ap.rdcpix.com/fcd6aaad385eb1abf1984798f998c72el-m677132878od-w480_h360_x2.webp?w=1080&q=75, http://ap.rdcpix.com/fcd6aaad385eb1abf1984798f998c72el-m584101059od-w480_h360_x2.webp?w=1080&q=75, http://ap.rdcpix.com/fcd6aaad385eb1abf1984798f998c72el-m3720475652od-w480_h360_x2.webp?w=1080&q=75, http://ap.rdcpix.com/fcd6aaad385eb1abf1984798f998c72el-m1161075466od-w480_h360_x2.webp?w=1080&q=75, http://ap.rdcpix.com/fcd6aaad385eb1abf1984798f998c72el-m1828514647od-w480_h360_x2.webp?w=1080&q=75, http://ap.rdcpix.com/fcd6aaad385eb1abf1984798f998c72el-m418651380od-w480_h360_x2.webp?w=1080&q=75, http://ap.rdcpix.com/fcd6aaad385eb1abf1984798f998c72el-m3165656892od-w480_h360_x2.webp?w=1080&q=75, http://ap.rdcpix.com/fcd6aaad385eb1abf1984798f998c72el-m2477476937od-w480_h360_x2.webp?w=1080&q=75, http://ap.rdcpix.com/fcd6aaad385eb1abf1984798f998c72el-m3003673721od-w480_h360_x2.webp?w=1080&q=75, http://ap.rdcpix.com/fcd6aaad385eb1abf1984798f998c72el-m664426257od-w480_h360_x2.webp?w=1080&q=75, http://ap.rdcpix.com/fcd6aaad385eb1abf1984798f998c72el-m1905658210od-w480_h360_x2.webp?w=1080&q=75, http://ap.rdcpix.com/fcd6aaad385eb1abf1984798f998c72el-m26271118od-w480_h360_x2.webp?w=1080&q=75, http://ap.rdcpix.com/fcd6aaad385eb1abf1984798f998c72el-m3953021931od-w480_h360_x2.webp?w=1080&q=75, http://ap.rdcpix.com/fcd6aaad385eb1abf1984798f998c72el-m1421365185od-w480_h360_x2.webp?w=1080&q=75, http://ap.rdcpix.com/fcd6aaad385eb1abf1984798f998c72el-m485260059od-w480_h360_x2.webp?w=1080&q=75, http://ap.rdcpix.com/fcd6aaad385eb1abf1984798f998c72el-m527554874od-w480_h360_x2.webp?w=1080&q=75, http://ap.rdcpix.com/fcd6aaad385eb1abf1984798f998c72el-m547417962od-w480_h360_x2.webp?w=1080&q=75, http://ap.rdcpix.com/fcd6aaad385eb1abf1984798f998c72el-m4152910395od-w480_h360_x2.webp?w=1080&q=75, http://ap.rdcpix.com/fcd6aaad385eb1abf1984798f998c72el-m949077013od-w480_h360_x2.webp?w=1080&q=75, http://ap.rdcpix.com/fcd6aaad385eb1abf1984798f998c72el-m3236928474od-w480_h360_x2.webp?w=1080&q=75, http://ap.rdcpix.com/fcd6aaad385eb1abf1984798f998c72el-m3181769747od-w480_h360_x2.webp?w=1080&q=75, http://ap.rdcpix.com/fcd6aaad385eb1abf1984798f998c72el-m655779108od-w480_h360_x2.webp?w=1080&q=75, http://ap.rdcpix.com/fcd6aaad385eb1abf1984798f998c72el-m2049112069od-w480_h360_x2.webp?w=1080&q=75, http://ap.rdcpix.com/fcd6aaad385eb1abf1984798f998c72el-m2962787784od-w480_h360_x2.webp?w=1080&q=75, http://ap.rdcpix.com/fcd6aaad385eb1abf1984798f998c72el-m1470272300od-w480_h360_x2.webp?w=1080&q=75, http://ap.rdcpix.com/fcd6aaad385eb1abf1984798f998c72el-m3893283109od-w480_h360_x2.webp?w=1080&q=75, http://ap.rdcpix.com/fcd6aaad385eb1abf1984798f998c72el-m1248013318od-w480_h360_x2.webp?w=1080&q=75, http://ap.rdcpix.com/fcd6aaad385eb1abf1984798f998c72el-m2535871883od-w480_h360_x2.webp?w=1080&q=75, http://ap.rdcpix.com/fcd6aaad385eb1abf1984798f998c72el-m2995828413od-w480_h360_x2.webp?w=1080&q=75, http://ap.rdcpix.com/fcd6aaad385eb1abf1984798f998c72el-m3896586363od-w480_h360_x2.webp?w=1080&q=75, http://ap.rdcpix.com/fcd6aaad385eb1abf1984798f998c72el-m2772010538od-w480_h360_x2.webp?w=1080&q=75, http://ap.rdcpix.com/fcd6aaad385eb1abf1984798f998c72el-m2071982340od-w480_h360_x2.webp?w=1080&q=75"
https://www.realtor.com/realestateandhomes-detail/9318-W-100th-Cir_Broomfield_CO_80021_M23136-78957,2313678957,2977382735,DVCO,2892018,PENDING,"This house has it all. This gorgeous freshly painted ranch has green space in back offering unparalleled privacy. This home features new luxury vinyl flooring in the living room which is open to the dining room with modern chandelier. Head out to the back deck overlooking green space leading to Ketner Reservoir or bike across the street to spend the day at Standly Lake. The kitchen is beautiful and clean with new cabinets and quartzite countertops with white subway tile backsplash. Down the hall you will find the best full bathroom possible including private door into master bedroom which has a walk in closet. The second bedroom on this level also has a walk in. Downstairs you will find the wonderful 3rd and 4th legal bedrooms plus office and the second and third 3/4 bathrooms plus a second living space with sliding door to the walk out yard. The yard has raised beds for your summer vegetable patch. Four bedrooms plus office or gym and 3 bathrooms and a two car attached garage-all in one package. Easy to show, super close to transportation and shopping so head on over. Upgraded sewer repair project being competed by seller.",SINGLE_FAMILY,9318 W 100th Cir,9318 W 100th Cir,,Broomfield,CO,80021,3,1,,1688,1978,16,495000,,,2025-01-18,192000,2017-05-18,22477,449100,1747,"[{'year': 2022, 'tax': 1747, 'assessment': {'building': 15064, 'land': 7413, 'total': 22477}}, {'year': 2021, 'tax': 1773, 'assessment': {'building': 15498, 'land': 7626, 'total': 23124}}, {'year': 2020, 'tax': 1631, 'assessment': {'building': 14110, 'land': 7281, 'total': 21391}}, {'year': 2019, 'tax': 1605, 'assessment': {'building': 14110, 'land': 7281, 'total': 21391}}, {'year': 2018, 'tax': 1442, 'assessment': {'building': 12937, 'land': 5644, 'total': 18581}}, {'year': 2017, 'tax': 1291, 'assessment': {'building': 12937, 'land': 5644, 'total': 18581}}, {'year': 2016, 'tax': 1200, 'assessment': {'building': 10324, 'land': 5694, 'total': 16018}}, {'year': 2015, 'tax': 1216, 'assessment': {'building': 10324, 'land': 5694, 'total': 16018}}, {'year': 2014, 'tax': 1006, 'assessment': {'building': 7371, 'land': 5149, 'total': 12520}}, {'year': 2013, 'tax': 1008, 'assessment': {'building': 7371, 'land': 5149, 'total': 12520}}, {'year': 2011, 'tax': 1024, 'assessment': {'building': 8270, 'land': 4975, 'total': 13245}}, {'year': 2009, 'tax': 1053, 'assessment': {'building': 8270, 'land': 4975, 'total': 13245}}, {'year': 2008, 'tax': 1085, 'assessment': {'building': 7670, 'land': 6060, 'total': 13730}}, {'year': 2007, 'tax': 1082, 'assessment': {'building': 8060, 'land': 6060, 'total': 14120}}, {'year': 2006, 'tax': 1093, 'assessment': {'building': 8340, 'land': 5740, 'total': 14080}}]",False,6822,293,39.880726,-105.104799,"West Westminster, Walnut Grove, Countryside",Jefferson,08059,1,0,2,726339,Carrie Hill,carrie@rmre-inc.com,"[{'ext': None, 'primary': True, 'type': 'Mobile', 'number': '3035799449'}, {'ext': None, 'primary': True, 'type': 'Office', 'number': '3033023533'}]",A-DVCO-21334689,217503669,1134515,Rocky Mountain RE,,,2741113,O-DVCO-M1116,Rocky Mountain Real Estate Inc,carrie@rmre-inc.com,"[{'number': '3035799449', 'type': 'Office', 'primary': True, 'ext': None}]",Jefferson County R-1 School District,http://ap.rdcpix.com/7931d7eda400820f8b6ac272458ac94dl-m147431645od-w480_h360_x2.webp?w=1080&q=75,"http://ap.rdcpix.com/7931d7eda400820f8b6ac272458ac94dl-m147431645od-w480_h360_x2.webp?w=1080&q=75, http://ap.rdcpix.com/7931d7eda400820f8b6ac272458ac94dl-m855033765od-w480_h360_x2.webp?w=1080&q=75, http://ap.rdcpix.com/7931d7eda400820f8b6ac272458ac94dl-m4027092883od-w480_h360_x2.webp?w=1080&q=75, http://ap.rdcpix.com/7931d7eda400820f8b6ac272458ac94dl-m2016708201od-w480_h360_x2.webp?w=1080&q=75, http://ap.rdcpix.com/7931d7eda400820f8b6ac272458ac94dl-m3910696227od-w480_h360_x2.webp?w=1080&q=75, http://ap.rdcpix.com/7931d7eda400820f8b6ac272458ac94dl-m3786054447od-w480_h360_x2.webp?w=1080&q=75, http://ap.rdcpix.com/7931d7eda400820f8b6ac272458ac94dl-m1705879795od-w480_h360_x2.webp?w=1080&q=75, http://ap.rdcpix.com/7931d7eda400820f8b6ac272458ac94dl-m3518878946od-w480_h360_x2.webp?w=1080&q=75, http://ap.rdcpix.com/7931d7eda400820f8b6ac272458ac94dl-m3397512570od-w480_h360_x2.webp?w=1080&q=75, http://ap.rdcpix.com/7931d7eda400820f8b6ac272458ac94dl-m309327919od-w480_h360_x2.webp?w=1080&q=75, http://ap.rdcpix.com/7931d7eda400820f8b6ac272458ac94dl-m2097531955od-w480_h360_x2.webp?w=1080&q=75, http://ap.rdcpix.com/7931d7eda400820f8b6ac272458ac94dl-m1164997886od-w480_h360_x2.webp?w=1080&q=75, http://ap.rdcpix.com/7931d7eda400820f8b6ac272458ac94dl-m908974083od-w480_h360_x2.webp?w=1080&q=75, http://ap.rdcpix.com/7931d7eda400820f8b6ac272458ac94dl-m622537565od-w480_h360_x2.webp?w=1080&q=75, http://ap.rdcpix.com/7931d7eda400820f8b6ac272458ac94dl-m1858285564od-w480_h360_x2.webp?w=1080&q=75, http://ap.rdcpix.com/7931d7eda400820f8b6ac272458ac94dl-m1774786363od-w480_h360_x2.webp?w=1080&q=75, http://ap.rdcpix.com/7931d7eda400820f8b6ac272458ac94dl-m2060399932od-w480_h360_x2.webp?w=1080&q=75, http://ap.rdcpix.com/7931d7eda400820f8b6ac272458ac94dl-m2341414847od-w480_h360_x2.webp?w=1080&q=75, http://ap.rdcpix.com/7931d7eda400820f8b6ac272458ac94dl-m3574781242od-w480_h360_x2.webp?w=1080&q=75, http://ap.rdcpix.com/7931d7eda400820f8b6ac272458ac94dl-m2924659054od-w480_h360_x2.webp?w=1080&q=75, http://ap.rdcpix.com/7931d7eda400820f8b6ac272458ac94dl-m2092154392od-w480_h360_x2.webp?w=1080&q=75, http://ap.rdcpix.com/7931d7eda400820f8b6ac272458ac94dl-m1804942687od-w480_h360_x2.webp?w=1080&q=75, http://ap.rdcpix.com/7931d7eda400820f8b6ac272458ac94dl-m3768645738od-w480_h360_x2.webp?w=1080&q=75, http://ap.rdcpix.com/7931d7eda400820f8b6ac272458ac94dl-m2166017495od-w480_h360_x2.webp?w=1080&q=75, http://ap.rdcpix.com/7931d7eda400820f8b6ac272458ac94dl-m2836113120od-w480_h360_x2.webp?w=1080&q=75, http://ap.rdcpix.com/7931d7eda400820f8b6ac272458ac94dl-m490616442od-w480_h360_x2.webp?w=1080&q=75, http://ap.rdcpix.com/7931d7eda400820f8b6ac272458ac94dl-m2865597489od-w480_h360_x2.webp?w=1080&q=75, http://ap.rdcpix.com/7931d7eda400820f8b6ac272458ac94dl-m1733198060od-w480_h360_x2.webp?w=1080&q=75, http://ap.rdcpix.com/7931d7eda400820f8b6ac272458ac94dl-m1983513512od-w480_h360_x2.webp?w=1080&q=75, http://ap.rdcpix.com/7931d7eda400820f8b6ac272458ac94dl-m2127408045od-w480_h360_x2.webp?w=1080&q=75, http://ap.rdcpix.com/7931d7eda400820f8b6ac272458ac94dl-m230002463od-w480_h360_x2.webp?w=1080&q=75, http://ap.rdcpix.com/7931d7eda400820f8b6ac272458ac94dl-m1249948825od-w480_h360_x2.webp?w=1080&q=75, http://ap.rdcpix.com/7931d7eda400820f8b6ac272458ac94dl-m2007400073od-w480_h360_x2.webp?w=1080&q=75, http://ap.rdcpix.com/7931d7eda400820f8b6ac272458ac94dl-m2564137886od-w480_h360_x2.webp?w=1080&q=75"
