property_url,property_id,listing_id,mls,mls_id,status,text,style,full_street_line,street,unit,city,state,zip_code,beds,full_baths,half_baths,sqft,year_built,days_on_mls,list_price,list_price_min,list_price_max,list_date,sold_price,last_sold_date,assessed_value,estimated_value,tax,tax_history,new_construction,lot_sqft,price_per_sqft,latitude,longitude,neighborhoods,county,fips_code,stories,hoa_fee,parking_garage,agent_id,agent_name,agent_email,agent_phones,agent_mls_set,agent_nrds_id,broker_id,broker_name,builder_id,builder_name,office_id,office_mls_set,office_name,office_email,office_phones,nearby_schools,primary_photo,alt_photos
https://www.realtor.com/realestateandhomes-detail/16293-Mount-Mestas-Way_Broomfield_CO_80023_M23204-68784,2320468784,2974090949,DVCO,5910518,PENDING,"Nestled in the sought-after Anthem Highlands community this well maintained walk-out ranch home presents an ideal blend of comfort, versatility & modern convenience. The main level boasts a bright and open floor plan with the living room centered around a cozy fireplace, creating a warm & inviting space. The kitchen features sleek stainless steel appliances, an island with additional seating & stunning granite countertops. Adjacent to the kitchen, the dining area opens directly onto a covered deck, offering a perfect spot for outdoor dining & entertaining. The main-level office provides a quiet, convenient space for work or study. The spacious primary bedroom is a private retreat, complete with an ensuite 5-piece bathroom. An additional bedroom & full bathroom on the main level provide comfort & convenience for guests or family members. The main-level laundry room adds practicality to everyday living. The fully finished walk-out basement expands the homes living space, making it perfect for extended family, guests, or rental opportunities. It includes a kitchen, a family room, & the convenience of a second laundry set. The ping pong/pool/dining table gives a flexible solution for entertainment and dining. With 2 additional bedrooms & bathrooms, the basement offers complete living quarters that are both private and functional. The front and backyard are landscaped with 9 mature trees. The home also comes equipped with leased solar panels, providing energy efficiency & cost savings. Located in the vibrant Anthem Highlands community, this home offers access to an array of top-tier amenities, including a resort-style clubhouse with a fitness center, pool & a variety of recreational activities. The community is surrounded by miles of scenic trails, parks & open spaces. Additionally the home is conveniently close to schools, shopping, dining, and major commuting routes, offering the perfect balance of peaceful suburban living and accessibility to city conveniences.",SINGLE_FAMILY,16293 Mount Mestas Way,16293 Mount Mestas Way,,Broomfield,CO,80023,4,3,,3926,2020,8,945000,,,2025-01-26,619682,2020-05-14,39520,949572,5462,"[{'year': 2022, 'tax': 5462, 'assessment': {'building': 29440, 'land': 10080, 'total': 39520}}, {'year': 2021, 'tax': 5636, 'assessment': {'building': 30290, 'land': 10370, 'total': 40660}}, {'year': 2020, 'tax': 2505, 'assessment': {'building': 8190, 'land': 9650, 'total': 17840}}, {'year': 2019, 'tax': 3701, 'assessment': {'building': None, 'land': 26250, 'total': 26250}}, {'year': 2018, 'tax': 2540, 'assessment': {'building': None, 'land': 17230, 'total': 17230}}, {'year': 2017, 'tax': 749, 'assessment': {'building': None, 'land': 5430, 'total': 5430}}, {'year': 2016, 'tax': 15, 'assessment': {'building': None, 'land': 110, 'total': 110}}]",False,7168,241,39.991664,-105.02849,"Anthem, Preble Creek, Anthem Highlands",Broomfield,08014,1,170,2,2285382,Linna Kvaldykova,linna.k@shorewood.com,"[{'ext': None, 'primary': True, 'type': 'Mobile', 'number': '7204967425'}]",A-DVCO-567321895,,2981659,BROKERS GUILD-CHERRY CREEK LTD -  Broker,,,2981663,O-DVCO-BG003,Brokers Guild Homes,guildacct@gmail.com,"[{'number': '3037520007', 'type': 'Office', 'primary': True, 'ext': None}]",Adams 12 Five Star Schools School District,http://ap.rdcpix.com/bb8e1c661258bcc8c337a5646c4236b6l-m1079954321od-w480_h360_x2.webp?w=1080&q=75,"http://ap.rdcpix.com/bb8e1c661258bcc8c337a5646c4236b6l-m1079954321od-w480_h360_x2.webp?w=1080&q=75, http://ap.rdcpix.com/bb8e1c661258bcc8c337a5646c4236b6l-m1888737153od-w480_h360_x2.webp?w=1080&q=75, http://ap.rdcpix.com/bb8e1c661258bcc8c337a5646c4236b6l-m1240512000od-w480_h360_x2.webp?w=1080&q=75, http://ap.rdcpix.com/bb8e1c661258bcc8c337a5646c4236b6l-m1019731269od-w480_h360_x2.webp?w=1080&q=75, http://ap.rdcpix.com/bb8e1c661258bcc8c337a5646c4236b6l-m479699509od-w480_h360_x2.webp?w=1080&q=75, http://ap.rdcpix.com/bb8e1c661258bcc8c337a5646c4236b6l-m2062740026od-w480_h360_x2.webp?w=1080&q=75, http://ap.rdcpix.com/bb8e1c661258bcc8c337a5646c4236b6l-m497230435od-w480_h360_x2.webp?w=1080&q=75, http://ap.rdcpix.com/bb8e1c661258bcc8c337a5646c4236b6l-m1189187658od-w480_h360_x2.webp?w=1080&q=75, http://ap.rdcpix.com/bb8e1c661258bcc8c337a5646c4236b6l-m3134592813od-w480_h360_x2.webp?w=1080&q=75, http://ap.rdcpix.com/bb8e1c661258bcc8c337a5646c4236b6l-m2822481644od-w480_h360_x2.webp?w=1080&q=75, http://ap.rdcpix.com/bb8e1c661258bcc8c337a5646c4236b6l-m87766316od-w480_h360_x2.webp?w=1080&q=75, http://ap.rdcpix.com/bb8e1c661258bcc8c337a5646c4236b6l-m1436753942od-w480_h360_x2.webp?w=1080&q=75, http://ap.rdcpix.com/bb8e1c661258bcc8c337a5646c4236b6l-m975239193od-w480_h360_x2.webp?w=1080&q=75, http://ap.rdcpix.com/bb8e1c661258bcc8c337a5646c4236b6l-m990376938od-w480_h360_x2.webp?w=1080&q=75, http://ap.rdcpix.com/bb8e1c661258bcc8c337a5646c4236b6l-m3351301254od-w480_h360_x2.webp?w=1080&q=75, http://ap.rdcpix.com/bb8e1c661258bcc8c337a5646c4236b6l-m2678471743od-w480_h360_x2.webp?w=1080&q=75, http://ap.rdcpix.com/bb8e1c661258bcc8c337a5646c4236b6l-m1718693709od-w480_h360_x2.webp?w=1080&q=75, http://ap.rdcpix.com/bb8e1c661258bcc8c337a5646c4236b6l-m3913539329od-w480_h360_x2.webp?w=1080&q=75, http://ap.rdcpix.com/bb8e1c661258bcc8c337a5646c4236b6l-m1091337011od-w480_h360_x2.webp?w=1080&q=75, http://ap.rdcpix.com/bb8e1c661258bcc8c337a5646c4236b6l-m1218147305od-w480_h360_x2.webp?w=1080&q=75, http://ap.rdcpix.com/bb8e1c661258bcc8c337a5646c4236b6l-m1645140295od-w480_h360_x2.webp?w=1080&q=75, http://ap.rdcpix.com/bb8e1c661258bcc8c337a5646c4236b6l-m1666305758od-w480_h360_x2.webp?w=1080&q=75, http://ap.rdcpix.com/bb8e1c661258bcc8c337a5646c4236b6l-m1510326364od-w480_h360_x2.webp?w=1080&q=75, http://ap.rdcpix.com/bb8e1c661258bcc8c337a5646c4236b6l-m2941614833od-w480_h360_x2.webp?w=1080&q=75, http://ap.rdcpix.com/bb8e1c661258bcc8c337a5646c4236b6l-m3045812942od-w480_h360_x2.webp?w=1080&q=75, http://ap.rdcpix.com/bb8e1c661258bcc8c337a5646c4236b6l-m3215251674od-w480_h360_x2.webp?w=1080&q=75, http://ap.rdcpix.com/bb8e1c661258bcc8c337a5646c4236b6l-m1871525533od-w480_h360_x2.webp?w=1080&q=75, http://ap.rdcpix.com/bb8e1c661258bcc8c337a5646c4236b6l-m359845432od-w480_h360_x2.webp?w=1080&q=75, http://ap.rdcpix.com/bb8e1c661258bcc8c337a5646c4236b6l-m3554219233od-w480_h360_x2.webp?w=1080&q=75, http://ap.rdcpix.com/bb8e1c661258bcc8c337a5646c4236b6l-m2930494514od-w480_h360_x2.webp?w=1080&q=75, http://ap.rdcpix.com/bb8e1c661258bcc8c337a5646c4236b6l-m2922220635od-w480_h360_x2.webp?w=1080&q=75, http://ap.rdcpix.com/bb8e1c661258bcc8c337a5646c4236b6l-m3153371907od-w480_h360_x2.webp?w=1080&q=75, http://ap.rdcpix.com/bb8e1c661258bcc8c337a5646c4236b6l-m3445889328od-w480_h360_x2.webp?w=1080&q=75, http://ap.rdcpix.com/bb8e1c661258bcc8c337a5646c4236b6l-m3920496370od-w480_h360_x2.webp?w=1080&q=75, http://ap.rdcpix.com/bb8e1c661258bcc8c337a5646c4236b6l-m2576983394od-w480_h360_x2.webp?w=1080&q=75, http://ap.rdcpix.com/bb8e1c661258bcc8c337a5646c4236b6l-m2336905604od-w480_h360_x2.webp?w=1080&q=75, http://ap.rdcpix.com/bb8e1c661258bcc8c337a5646c4236b6l-m1254600702od-w480_h360_x2.webp?w=1080&q=75, http://ap.rdcpix.com/bb8e1c661258bcc8c337a5646c4236b6l-m4155378337od-w480_h360_x2.webp?w=1080&q=75, http://ap.rdcpix.com/bb8e1c661258bcc8c337a5646c4236b6l-m4230312397od-w480_h360_x2.webp?w=1080&q=75, http://ap.rdcpix.com/bb8e1c661258bcc8c337a5646c4236b6l-m3411324831od-w480_h360_x2.webp?w=1080&q=75, http://ap.rdcpix.com/bb8e1c661258bcc8c337a5646c4236b6l-m3803133228od-w480_h360_x2.webp?w=1080&q=75, http://ap.rdcpix.com/bb8e1c661258bcc8c337a5646c4236b6l-m3250674917od-w480_h360_x2.webp?w=1080&q=75, http://ap.rdcpix.com/bb8e1c661258bcc8c337a5646c4236b6l-m2347141069od-w480_h360_x2.webp?w=1080&q=75, http://ap.rdcpix.com/bb8e1c661258bcc8c337a5646c4236b6l-m1398129446od-w480_h360_x2.webp?w=1080&q=75, http://ap.rdcpix.com/bb8e1c661258bcc8c337a5646c4236b6l-m3241291047od-w480_h360_x2.webp?w=1080&q=75, http://ap.rdcpix.com/bb8e1c661258bcc8c337a5646c4236b6l-m3379954287od-w480_h360_x2.webp?w=1080&q=75, http://ap.rdcpix.com/bb8e1c661258bcc8c337a5646c4236b6l-m2842014542od-w480_h360_x2.webp?w=1080&q=75, http://ap.rdcpix.com/bb8e1c661258bcc8c337a5646c4236b6l-m1794114626od-w480_h360_x2.webp?w=1080&q=75, http://ap.rdcpix.com/bb8e1c661258bcc8c337a5646c4236b6l-m2419421351od-w480_h360_x2.webp?w=1080&q=75, http://ap.rdcpix.com/bb8e1c661258bcc8c337a5646c4236b6l-m1844596569od-w480_h360_x2.webp?w=1080&q=75"
https://www.realtor.com/realestateandhomes-detail/5603-W-118th-Pl_Westminster_CO_80020_M11899-42313,1189942313,2977743637,DVCO,2158684,PENDING,"Meticulously maintained & move-in ready means you don't need to look any further! With a new roof in 2024 as well as paid off Solar System. The main floor as well as upstairs landing, lower family room & primary bedroom have newer modern, neutral-colored wide-plank LVP flooring & newer carpeting in the 2 additional bedrooms. All lighting has been updated for a modern feel as well as new ceiling fans in all bedrooms. Recently updated Guest bathroom with shiplap and honeycomb floor tiles feels modern and warm. Custom wood blinds throughout bring sophistication and beauty to the many windows. West facing, this home has amazing natural light and neutral paint makes this home feel inviting. Smart sprinkler system, landscaped backyard, radiant tile flooring in the primary bathroom, all new toilets, new front door, custom mantel and more! All updates have been done in the last 2 years with attention to detail and an eye for luxurious touches. More than convenient location! Only half a mile to Greenway Park Golf Course, dozens of food and brewery options, above average rated schools, 4 parks within 2 miles.",SINGLE_FAMILY,5603 W 118th Pl,5603 W 118th Pl,,Broomfield,CO,80020,3,1,1,1924,1997,5,625000,,,2025-01-29,552000,2023-03-01,28547,581862,2219,"[{'year': 2022, 'tax': 2219, 'assessment': {'building': 21347, 'land': 7200, 'total': 28547}}, {'year': 2021, 'tax': 2252, 'assessment': {'building': 21962, 'land': 7407, 'total': 29369}}, {'year': 2020, 'tax': 2103, 'assessment': {'building': 20416, 'land': 7161, 'total': 27577}}, {'year': 2019, 'tax': 2069, 'assessment': {'building': 20416, 'land': 7161, 'total': 27577}}, {'year': 2018, 'tax': 1693, 'assessment': {'building': 16604, 'land': 5212, 'total': 21816}}, {'year': 2017, 'tax': 1516, 'assessment': {'building': 16604, 'land': 5212, 'total': 21816}}, {'year': 2016, 'tax': 1576, 'assessment': {'building': 14806, 'land': 6233, 'total': 21039}}, {'year': 2015, 'tax': 1598, 'assessment': {'building': 14806, 'land': 6233, 'total': 21039}}, {'year': 2014, 'tax': 1339, 'assessment': {'building': 11096, 'land': 5572, 'total': 16668}}, {'year': 2013, 'tax': 1342, 'assessment': {'building': 11096, 'land': 5572, 'total': 16668}}, {'year': 2011, 'tax': 1361, 'assessment': {'building': 12664, 'land': 4935, 'total': 17599}}, {'year': 2009, 'tax': 1314, 'assessment': {'building': 12664, 'land': 4935, 'total': 17599}}, {'year': 2008, 'tax': 1410, 'assessment': {'building': 10900, 'land': 6230, 'total': 17130}}, {'year': 2007, 'tax': 1407, 'assessment': {'building': 12120, 'land': 6230, 'total': 18350}}, {'year': 2006, 'tax': 1407, 'assessment': {'building': 12120, 'land': 6010, 'total': 18130}}]",False,4725,325,39.911574,-105.057548,"Central Westminster, Torrey Peaks",Jefferson,08059,2,35,2,3160678,Venessa Snow,Venessa.soldbysnow@gmail.com,"[{'ext': None, 'primary': True, 'type': 'Mobile', 'number': '9708882955'}]",A-DVCO-595397373,,,Guide Real Estate,,,,O-DVCO-M5791,Guide Real Estate,emily@denverrealestate.com,"[{'number': '(303) 398-7033', 'type': 'Office', 'primary': True, 'ext': None}]","Charter School Institute School District, Jefferson County R-1 School District",http://ap.rdcpix.com/eb32e755fd4b497506396034aae5b3f1l-m3967060810od-w480_h360_x2.webp?w=1080&q=75,"http://ap.rdcpix.com/eb32e755fd4b497506396034aae5b3f1l-m3967060810od-w480_h360_x2.webp?w=1080&q=75, http://ap.rdcpix.com/eb32e755fd4b497506396034aae5b3f1l-m2183470820od-w480_h360_x2.webp?w=1080&q=75, http://ap.rdcpix.com/eb32e755fd4b497506396034aae5b3f1l-m3899554542od-w480_h360_x2.webp?w=1080&q=75, http://ap.rdcpix.com/eb32e755fd4b497506396034aae5b3f1l-m2687112159od-w480_h360_x2.webp?w=1080&q=75, http://ap.rdcpix.com/eb32e755fd4b497506396034aae5b3f1l-m2566204976od-w480_h360_x2.webp?w=1080&q=75, http://ap.rdcpix.com/eb32e755fd4b497506396034aae5b3f1l-m301664020od-w480_h360_x2.webp?w=1080&q=75, http://ap.rdcpix.com/eb32e755fd4b497506396034aae5b3f1l-m1637810140od-w480_h360_x2.webp?w=1080&q=75, http://ap.rdcpix.com/eb32e755fd4b497506396034aae5b3f1l-m2663438198od-w480_h360_x2.webp?w=1080&q=75, http://ap.rdcpix.com/eb32e755fd4b497506396034aae5b3f1l-m2376626365od-w480_h360_x2.webp?w=1080&q=75, http://ap.rdcpix.com/eb32e755fd4b497506396034aae5b3f1l-m3674277714od-w480_h360_x2.webp?w=1080&q=75, http://ap.rdcpix.com/eb32e755fd4b497506396034aae5b3f1l-m3654413135od-w480_h360_x2.webp?w=1080&q=75, http://ap.rdcpix.com/eb32e755fd4b497506396034aae5b3f1l-m3129903087od-w480_h360_x2.webp?w=1080&q=75, http://ap.rdcpix.com/eb32e755fd4b497506396034aae5b3f1l-m282644701od-w480_h360_x2.webp?w=1080&q=75, http://ap.rdcpix.com/eb32e755fd4b497506396034aae5b3f1l-m380971721od-w480_h360_x2.webp?w=1080&q=75, http://ap.rdcpix.com/eb32e755fd4b497506396034aae5b3f1l-m2720233856od-w480_h360_x2.webp?w=1080&q=75, http://ap.rdcpix.com/eb32e755fd4b497506396034aae5b3f1l-m1103823245od-w480_h360_x2.webp?w=1080&q=75, http://ap.rdcpix.com/eb32e755fd4b497506396034aae5b3f1l-m1769077694od-w480_h360_x2.webp?w=1080&q=75, http://ap.rdcpix.com/eb32e755fd4b497506396034aae5b3f1l-m1598856077od-w480_h360_x2.webp?w=1080&q=75, http://ap.rdcpix.com/eb32e755fd4b497506396034aae5b3f1l-m3156949764od-w480_h360_x2.webp?w=1080&q=75, http://ap.rdcpix.com/eb32e755fd4b497506396034aae5b3f1l-m480638537od-w480_h360_x2.webp?w=1080&q=75, http://ap.rdcpix.com/eb32e755fd4b497506396034aae5b3f1l-m2440225705od-w480_h360_x2.webp?w=1080&q=75"
https://www.realtor.com/realestateandhomes-detail/723-176th-Ave_Broomfield_CO_80023_M95882-13014,9588213014,2977604940,DVCO,4991269,FOR_SALE,"Nestled in the heart of Palisade Park, this charming 3-bedroom 3-bathroom home is a haven of comfort and modern living. From the moment you arrive, youre greeted with a beautiful exterior complete with a covered front porch, fragrant rose bushes, video doorbell, and a two-car attached garage. As you step into the inviting foyer, you're welcomed by luxury vinyl floors that seamlessly flow through an open-concept main level. The modern kitchen, boasting newer stainless steel appliances, quartz countertops, pantry, and a stylish subway tile backsplash, is perfect for culinary adventures. The cozy living room provides easy access to the backyard, seamlessly connect the interior and exterior, ideal for entertaining or relaxing. The backyard encompasses a beautifully landscaped space, featuring a covered deck, an additional patio space, raised wooden flower boxes, and a gas line for a grill. The main level is completed with a designated dining area and 1/2 bathroom. Journey upstairs to find the serene primary suite complete with recessed lighting, a walk-in closet, and a primary 3/4 bath with dual sinks. The second floor also features a convenient laundry room, two additional bedrooms, a full bathroom, and a versatile loft space, perfect for a home office, playroom, or whatever your heart desires! The lower level offers an abundance of unfinished space, ready for your creative touch. With egress windows and a sump pump, it's an ideal location for any additional needs you may have. This home includes additional features such as leased Sunnova solar panels, and a comprehensive security system. Residents of this community benefit from amenities including a park, playground, trails, and a low monthly HOA fee that covers recycling, trash, and snow removal. Perfectly situated near Hearthstone Park, Colorado National Golf Club, and Larkridge Shopping Center, this home offers easy access to shopping, dining, and I-25, making commuting a breeze.",SINGLE_FAMILY,723 176th Ave,723 176th Ave,,Broomfield,CO,80023,3,1,1,2926,2021,9,585000,,,2025-01-25,521400,2021-09-21,32820,583400,5404,"[{'year': 2022, 'tax': 5404, 'assessment': {'building': 26560, 'land': 6260, 'total': 32820}}, {'year': 2021, 'tax': 1694, 'assessment': {'building': None, 'land': 10430, 'total': 10430}}, {'year': 2020, 'tax': 391, 'assessment': {'building': None, 'land': 2330, 'total': 2330}}]",False,3889,200,40.015758,-104.995844,"North Broomfield, North Park West",Broomfield,08014,2,65,2,1256974,Jenny Usaj,jenny@usajrealty.com,"[{'ext': None, 'primary': True, 'type': 'Office', 'number': '7203982999'}, {'ext': None, 'primary': True, 'type': 'Mobile', 'number': '9705148960'}]",A-DVCO-21342180,219520608,2962392,Usaj Realty - Broker,,,2149149,O-DVCO-USAJ1,Usaj Realty,info@usajrealty.com,"[{'number': '7203982999', 'type': 'Office', 'primary': True, 'ext': None}, {'number': '7208835714', 'type': 'Mobile', 'primary': True, 'ext': None}, {'number': '7208835714', 'type': 'Mobile', 'primary': True, 'ext': None}]",St Vrain Valley Re 1j School District,http://ap.rdcpix.com/cb3628e2c9be740b89d13728d8fc9634l-m2728000397od-w480_h360_x2.webp?w=1080&q=75,"http://ap.rdcpix.com/cb3628e2c9be740b89d13728d8fc9634l-m2728000397od-w480_h360_x2.webp?w=1080&q=75, http://ap.rdcpix.com/cb3628e2c9be740b89d13728d8fc9634l-m3000261317od-w480_h360_x2.webp?w=1080&q=75, http://ap.rdcpix.com/cb3628e2c9be740b89d13728d8fc9634l-m1056713166od-w480_h360_x2.webp?w=1080&q=75, http://ap.rdcpix.com/cb3628e2c9be740b89d13728d8fc9634l-m933777852od-w480_h360_x2.webp?w=1080&q=75, http://ap.rdcpix.com/cb3628e2c9be740b89d13728d8fc9634l-m7159131od-w480_h360_x2.webp?w=1080&q=75, http://ap.rdcpix.com/cb3628e2c9be740b89d13728d8fc9634l-m3732970120od-w480_h360_x2.webp?w=1080&q=75, http://ap.rdcpix.com/cb3628e2c9be740b89d13728d8fc9634l-m3024458379od-w480_h360_x2.webp?w=1080&q=75, http://ap.rdcpix.com/cb3628e2c9be740b89d13728d8fc9634l-m2303318832od-w480_h360_x2.webp?w=1080&q=75, http://ap.rdcpix.com/cb3628e2c9be740b89d13728d8fc9634l-m2849136539od-w480_h360_x2.webp?w=1080&q=75, http://ap.rdcpix.com/cb3628e2c9be740b89d13728d8fc9634l-m4082402437od-w480_h360_x2.webp?w=1080&q=75, http://ap.rdcpix.com/cb3628e2c9be740b89d13728d8fc9634l-m1304876274od-w480_h360_x2.webp?w=1080&q=75, http://ap.rdcpix.com/cb3628e2c9be740b89d13728d8fc9634l-m2937456523od-w480_h360_x2.webp?w=1080&q=75, http://ap.rdcpix.com/cb3628e2c9be740b89d13728d8fc9634l-m1445040417od-w480_h360_x2.webp?w=1080&q=75, http://ap.rdcpix.com/cb3628e2c9be740b89d13728d8fc9634l-m1059390247od-w480_h360_x2.webp?w=1080&q=75, http://ap.rdcpix.com/cb3628e2c9be740b89d13728d8fc9634l-m975726492od-w480_h360_x2.webp?w=1080&q=75, http://ap.rdcpix.com/cb3628e2c9be740b89d13728d8fc9634l-m247756658od-w480_h360_x2.webp?w=1080&q=75, http://ap.rdcpix.com/cb3628e2c9be740b89d13728d8fc9634l-m862885517od-w480_h360_x2.webp?w=1080&q=75, http://ap.rdcpix.com/cb3628e2c9be740b89d13728d8fc9634l-m999689489od-w480_h360_x2.webp?w=1080&q=75, http://ap.rdcpix.com/cb3628e2c9be740b89d13728d8fc9634l-m1512850626od-w480_h360_x2.webp?w=1080&q=75, http://ap.rdcpix.com/cb3628e2c9be740b89d13728d8fc9634l-m3681782595od-w480_h360_x2.webp?w=1080&q=75, http://ap.rdcpix.com/cb3628e2c9be740b89d13728d8fc9634l-m1415221992od-w480_h360_x2.webp?w=1080&q=75, http://ap.rdcpix.com/cb3628e2c9be740b89d13728d8fc9634l-m3082508531od-w480_h360_x2.webp?w=1080&q=75, http://ap.rdcpix.com/cb3628e2c9be740b89d13728d8fc9634l-m1122087456od-w480_h360_x2.webp?w=1080&q=75, http://ap.rdcpix.com/cb3628e2c9be740b89d13728d8fc9634l-m243549045od-w480_h360_x2.webp?w=1080&q=75, http://ap.rdcpix.com/cb3628e2c9be740b89d13728d8fc9634l-m4183364913od-w480_h360_x2.webp?w=1080&q=75, http://ap.rdcpix.com/cb3628e2c9be740b89d13728d8fc9634l-m833884018od-w480_h360_x2.webp?w=1080&q=75, http://ap.rdcpix.com/cb3628e2c9be740b89d13728d8fc9634l-m3526085958od-w480_h360_x2.webp?w=1080&q=75, http://ap.rdcpix.com/cb3628e2c9be740b89d13728d8fc9634l-m87792424od-w480_h360_x2.webp?w=1080&q=75, http://ap.rdcpix.com/cb3628e2c9be740b89d13728d8fc9634l-m2554716460od-w480_h360_x2.webp?w=1080&q=75, http://ap.rdcpix.com/cb3628e2c9be740b89d13728d8fc9634l-m341036521od-w480_h360_x2.webp?w=1080&q=75, http://ap.rdcpix.com/cb3628e2c9be740b89d13728d8fc9634l-m4026128485od-w480_h360_x2.webp?w=1080&q=75, http://ap.rdcpix.com/cb3628e2c9be740b89d13728d8fc9634l-m669881686od-w480_h360_x2.webp?w=1080&q=75, http://ap.rdcpix.com/cb3628e2c9be740b89d13728d8fc9634l-m3537508134od-w480_h360_x2.webp?w=1080&q=75, http://ap.rdcpix.com/cb3628e2c9be740b89d13728d8fc9634l-m2509249496od-w480_h360_x2.webp?w=1080&q=75, http://ap.rdcpix.com/cb3628e2c9be740b89d13728d8fc9634l-m3945971284od-w480_h360_x2.webp?w=1080&q=75, http://ap.rdcpix.com/cb3628e2c9be740b89d13728d8fc9634l-m556207917od-w480_h360_x2.webp?w=1080&q=75, http://ap.rdcpix.com/cb3628e2c9be740b89d13728d8fc9634l-m1512581365od-w480_h360_x2.webp?w=1080&q=75, http://ap.rdcpix.com/cb3628e2c9be740b89d13728d8fc9634l-m1663921619od-w480_h360_x2.webp?w=1080&q=75, http://ap.rdcpix.com/cb3628e2c9be740b89d13728d8fc9634l-m1693445502od-w480_h360_x2.webp?w=1080&q=75, http://ap.rdcpix.com/cb3628e2c9be740b89d13728d8fc9634l-m1037781163od-w480_h360_x2.webp?w=1080&q=75, http://ap.rdcpix.com/cb3628e2c9be740b89d13728d8fc9634l-m3232678995od-w480_h360_x2.webp?w=1080&q=75, http://ap.rdcpix.com/cb3628e2c9be740b89d13728d8fc9634l-m1915816303od-w480_h360_x2.webp?w=1080&q=75, http://ap.rdcpix.com/cb3628e2c9be740b89d13728d8fc9634l-m453465368od-w480_h360_x2.webp?w=1080&q=75, http://ap.rdcpix.com/cb3628e2c9be740b89d13728d8fc9634l-m1665841422od-w480_h360_x2.webp?w=1080&q=75, http://ap.rdcpix.com/cb3628e2c9be740b89d13728d8fc9634l-m1389144556od-w480_h360_x2.webp?w=1080&q=75, http://ap.rdcpix.com/cb3628e2c9be740b89d13728d8fc9634l-m3636717668od-w480_h360_x2.webp?w=1080&q=75, http://ap.rdcpix.com/cb3628e2c9be740b89d13728d8fc9634l-m3398482495od-w480_h360_x2.webp?w=1080&q=75, http://ap.rdcpix.com/cb3628e2c9be740b89d13728d8fc9634l-m2545770453od-w480_h360_x2.webp?w=1080&q=75, http://ap.rdcpix.com/cb3628e2c9be740b89d13728d8fc9634l-m3905138417od-w480_h360_x2.webp?w=1080&q=75, http://ap.rdcpix.com/cb3628e2c9be740b89d13728d8fc9634l-m712131090od-w480_h360_x2.webp?w=1080&q=75"
