property_url,property_id,listing_id,mls,mls_id,status,text,style,full_street_line,street,unit,city,state,zip_code,beds,full_baths,half_baths,sqft,year_built,days_on_mls,list_price,list_price_min,list_price_max,list_date,sold_price,last_sold_date,assessed_value,estimated_value,tax,tax_history,new_construction,lot_sqft,price_per_sqft,latitude,longitude,neighborhoods,county,fips_code,stories,hoa_fee,parking_garage,agent_id,agent_name,agent_email,agent_phones,agent_mls_set,agent_nrds_id,broker_id,broker_name,builder_id,builder_name,office_id,office_mls_set,office_name,office_email,office_phones,nearby_schools,primary_photo,alt_photos
https://www.realtor.com/realestateandhomes-detail/13732-Raritan-Ln_Broomfield_CO_80023_M21743-55169,2174355169,2977793953,DVCO,7655090,FOR_SALE,"Discover this gorgeous move-in ready 4-bedroom, 4-bathroom home in the highly desirable Lambertson Farms. Offering a perfect mix of modern features, spacious design, and prime location, this home is a must-see! High ceilings and huge windows create an inviting, light and bright layout, perfect for entertaining. The chefs kitchen features a large island with bar seating, extensive cabinet space, quartz counters, and stainless steel appliances, including a 5-burner gas range. A spacious pantry with a perfect home-office nook adds extra convenience. Upstairs, a generous loft provides a versatile space for a play room, home gym, office, or flex space. The primary suite offers a spa-inspired 5-piece bath and walk-in closet. Two additional bedrooms, a full bathroom, and laundry room complete the upper floor. The fully finished basement extends your living space with a fourth bedroom, another full bath, an expansive recreation or game room, and plenty of storage areas. Step outside to enjoy your low-maintenance yard, complete with a concrete patio and turf area. Additional highlights include an attached 2-car garage with epoxy floors, mudroom off the garage, energy-efficient tankless water heater, radon mitigation system, and a transferable solar lease. The surrounding HOA-maintained green spaces, nearby parks, shopping, and restaurants make this an ideal location. Dont miss your opportunity to see this well cared-for home in the heart Broomfield!",SINGLE_FAMILY,13732 Raritan Ln,13732 Raritan Ln,,Broomfield,CO,80023,4,3,1,3025,2017,3,724900,,,2025-01-31,570000,2020-07-17,36550,740250,5590,"[{'year': 2022, 'tax': 5590, 'assessment': {'building': 28560, 'land': 7990, 'total': 36550}}, {'year': 2021, 'tax': 5721, 'assessment': {'building': 29390, 'land': 8220, 'total': 37610}}, {'year': 2020, 'tax': 5370, 'assessment': {'building': 27510, 'land': 7510, 'total': 35020}}, {'year': 2019, 'tax': 5371, 'assessment': {'building': 27700, 'land': 7560, 'total': 35260}}, {'year': 2018, 'tax': 4229, 'assessment': {'building': 20570, 'land': 6480, 'total': 27050}}, {'year': 2017, 'tax': 1692, 'assessment': {'building': 5140, 'land': 6480, 'total': 11620}}, {'year': 2016, 'tax': 1000, 'assessment': {'building': None, 'land': 6890, 'total': 6890}}, {'year': 2015, 'tax': 899, 'assessment': {'building': None, 'land': 6190, 'total': 6190}}]",False,2508,240,39.945154,-105.009845,McKay Shores,Broomfield,08014,2,207,2,1458965,Lisa Case,lisa.case@larkmountain.com,"[{'ext': None, 'primary': True, 'type': 'Office', 'number': '9705755275'}]",A-DVCO-21336207,229003690,1458830,Keller Williams Preferred Realty,,,1458833,O-DVCO-KWR80,Keller Williams Preferred Realty,sarno@kw.com,"[{'number': '3034523300', 'type': 'Office', 'primary': True, 'ext': None}, {'number': '3034529620', 'type': 'Fax', 'primary': False, 'ext': None}]",Adams 12 Five Star Schools School District,http://ap.rdcpix.com/89a52831123e14596282a87477d74ca7l-m2693201921od-w480_h360_x2.webp?w=1080&q=75,"http://ap.rdcpix.com/89a52831123e14596282a87477d74ca7l-m2693201921od-w480_h360_x2.webp?w=1080&q=75, http://ap.rdcpix.com/89a52831123e14596282a87477d74ca7l-m2171795688od-w480_h360_x2.webp?w=1080&q=75, http://ap.rdcpix.com/89a52831123e14596282a87477d74ca7l-m1501456042od-w480_h360_x2.webp?w=1080&q=75, http://ap.rdcpix.com/89a52831123e14596282a87477d74ca7l-m2663399250od-w480_h360_x2.webp?w=1080&q=75, http://ap.rdcpix.com/89a52831123e14596282a87477d74ca7l-m1356930279od-w480_h360_x2.webp?w=1080&q=75, http://ap.rdcpix.com/89a52831123e14596282a87477d74ca7l-m3066555922od-w480_h360_x2.webp?w=1080&q=75, http://ap.rdcpix.com/89a52831123e14596282a87477d74ca7l-m2162348406od-w480_h360_x2.webp?w=1080&q=75, http://ap.rdcpix.com/89a52831123e14596282a87477d74ca7l-m51386657od-w480_h360_x2.webp?w=1080&q=75, http://ap.rdcpix.com/89a52831123e14596282a87477d74ca7l-m3189062468od-w480_h360_x2.webp?w=1080&q=75, http://ap.rdcpix.com/89a52831123e14596282a87477d74ca7l-m2913164175od-w480_h360_x2.webp?w=1080&q=75, http://ap.rdcpix.com/89a52831123e14596282a87477d74ca7l-m2876240610od-w480_h360_x2.webp?w=1080&q=75, http://ap.rdcpix.com/89a52831123e14596282a87477d74ca7l-m2122693735od-w480_h360_x2.webp?w=1080&q=75, http://ap.rdcpix.com/89a52831123e14596282a87477d74ca7l-m696348506od-w480_h360_x2.webp?w=1080&q=75, http://ap.rdcpix.com/89a52831123e14596282a87477d74ca7l-m4172135310od-w480_h360_x2.webp?w=1080&q=75, http://ap.rdcpix.com/89a52831123e14596282a87477d74ca7l-m2984815426od-w480_h360_x2.webp?w=1080&q=75, http://ap.rdcpix.com/89a52831123e14596282a87477d74ca7l-m254682697od-w480_h360_x2.webp?w=1080&q=75, http://ap.rdcpix.com/89a52831123e14596282a87477d74ca7l-m3693049264od-w480_h360_x2.webp?w=1080&q=75, http://ap.rdcpix.com/89a52831123e14596282a87477d74ca7l-m558985570od-w480_h360_x2.webp?w=1080&q=75, http://ap.rdcpix.com/89a52831123e14596282a87477d74ca7l-m3610579827od-w480_h360_x2.webp?w=1080&q=75, http://ap.rdcpix.com/89a52831123e14596282a87477d74ca7l-m1064938328od-w480_h360_x2.webp?w=1080&q=75, http://ap.rdcpix.com/89a52831123e14596282a87477d74ca7l-m450708226od-w480_h360_x2.webp?w=1080&q=75, http://ap.rdcpix.com/89a52831123e14596282a87477d74ca7l-m4151618734od-w480_h360_x2.webp?w=1080&q=75, http://ap.rdcpix.com/89a52831123e14596282a87477d74ca7l-m2800786859od-w480_h360_x2.webp?w=1080&q=75, http://ap.rdcpix.com/89a52831123e14596282a87477d74ca7l-m3552398012od-w480_h360_x2.webp?w=1080&q=75, http://ap.rdcpix.com/89a52831123e14596282a87477d74ca7l-m2741839647od-w480_h360_x2.webp?w=1080&q=75, http://ap.rdcpix.com/89a52831123e14596282a87477d74ca7l-m3183922551od-w480_h360_x2.webp?w=1080&q=75, http://ap.rdcpix.com/89a52831123e14596282a87477d74ca7l-m2143945025od-w480_h360_x2.webp?w=1080&q=75, http://ap.rdcpix.com/89a52831123e14596282a87477d74ca7l-m1347181060od-w480_h360_x2.webp?w=1080&q=75, http://ap.rdcpix.com/89a52831123e14596282a87477d74ca7l-m3746698251od-w480_h360_x2.webp?w=1080&q=75, http://ap.rdcpix.com/89a52831123e14596282a87477d74ca7l-m2421860974od-w480_h360_x2.webp?w=1080&q=75, http://ap.rdcpix.com/89a52831123e14596282a87477d74ca7l-m1904205375od-w480_h360_x2.webp?w=1080&q=75, http://ap.rdcpix.com/89a52831123e14596282a87477d74ca7l-m504317510od-w480_h360_x2.webp?w=1080&q=75, http://ap.rdcpix.com/89a52831123e14596282a87477d74ca7l-m4276462233od-w480_h360_x2.webp?w=1080&q=75, http://ap.rdcpix.com/89a52831123e14596282a87477d74ca7l-m343624838od-w480_h360_x2.webp?w=1080&q=75, http://ap.rdcpix.com/89a52831123e14596282a87477d74ca7l-m1855456467od-w480_h360_x2.webp?w=1080&q=75, http://ap.rdcpix.com/89a52831123e14596282a87477d74ca7l-m2083465665od-w480_h360_x2.webp?w=1080&q=75, http://ap.rdcpix.com/89a52831123e14596282a87477d74ca7l-m1103032378od-w480_h360_x2.webp?w=1080&q=75, http://ap.rdcpix.com/89a52831123e14596282a87477d74ca7l-m837791670od-w480_h360_x2.webp?w=1080&q=75"
https://www.realtor.com/realestateandhomes-detail/3146-W-134th-Ct_Broomfield_CO_80020_M26357-24750,2635724750,2977662192,BOCO,1025312,FOR_SALE,"This move-in ready ranch home with main level living has several positive features - Terrific location at end of a cul-de-sac in a quiet neighborhood & in the highly rated Adams 5 star school district with Centennial Elementary school, Westlake Middle school & Legacy High School all within a 5 minute drive. The large fenced back yard with a beautiful lawn accentuated with lovely gardens is ideal for gatherings & entertainment. This must see 3 bedroom ranch home has been well cared for by the owners and comes with newer features including an 14 year old roof with a 30 yr useful life, new Champion windows installed in 2010, cellular window shades that help keep the home cool and the main floor bathroom is tastefully updated with a walk-in shower. You'll appreciate the newer wood floors - red oak in the kitchen installed in 2014 & engineered flooring in the living room installed in 2022. Granite counters grace the kitchen that has plenty of cabinets - all kitchen appliances are included in the sale. Also on the main level is a dining area that opens to the living room providing ample space for coffee & relaxation. The lower level (potential for rental lock-off) provides a rec room, office nook, a full bathroom, the utility room with washer/dryer and a separate storage area - lots of storage space! An oversized attached 2 car garage allows for storage of your toys & tools. Come see why so many folks like living in Westlake - a lovely community with multiple green belts & walking paths. Nearby popular amenities include the Paul Derda Rec Center, 2 shopping malls, a large King Soopers, Costco, Target & Top Golf. Near C-470 & I-25. Centrally located between Denver & Boulder. Listing expected to be Active on Tuesday, Jan 28",SINGLE_FAMILY,3146 W 134th Ct,3146 W 134th Ct,,Broomfield,CO,80020,3,1,,1976,1974,6,525000,,,2025-01-28,147583,1992-10-19,22270,496700,1730,"[{'year': 2022, 'tax': 1730, 'assessment': {'building': 16500, 'land': 5770, 'total': 22270}}, {'year': 2021, 'tax': 1783, 'assessment': {'building': 16970, 'land': 5930, 'total': 22900}}, {'year': 2020, 'tax': 1710, 'assessment': {'building': 16580, 'land': 5510, 'total': 22090}}, {'year': 2019, 'tax': 1711, 'assessment': {'building': 16700, 'land': 5540, 'total': 22240}}, {'year': 2018, 'tax': 1231, 'assessment': {'building': 13430, 'land': 4210, 'total': 17640}}, {'year': 2017, 'tax': 1121, 'assessment': {'building': 13430, 'land': 4210, 'total': 17640}}, {'year': 2016, 'tax': 880, 'assessment': {'building': 11290, 'land': 4660, 'total': 15950}}, {'year': 2015, 'tax': 880, 'assessment': {'building': 11290, 'land': 4660, 'total': 15950}}, {'year': 2014, 'tax': 1516, 'assessment': {'building': 8730, 'land': 4660, 'total': 13390}}, {'year': 2013, 'tax': 1465, 'assessment': {'building': 8730, 'land': 4660, 'total': 13390}}, {'year': 2011, 'tax': 1495, 'assessment': {'building': 8810, 'land': 4660, 'total': 13470}}, {'year': 2010, 'tax': 1496, 'assessment': {'building': 8810, 'land': 4660, 'total': 13470}}, {'year': 2009, 'tax': 1494, 'assessment': {'building': 8810, 'land': 4660, 'total': 13470}}, {'year': 2008, 'tax': 1637, 'assessment': {'building': 10170, 'land': 4660, 'total': 14830}}, {'year': 2007, 'tax': 1562, 'assessment': {'building': 10170, 'land': 4660, 'total': 14830}}]",False,8800,266,39.93804,-105.025072,Westlake Village,Broomfield,08014,1,0,2,99918470,David Elmblad,,"[{'ext': None, 'primary': True, 'type': 'BUSINESS_MOBILE', 'number': '9703764407'}]",A-BOCO-P18408,,3452995,Coldwell Banker Realty - Canyon Blvd - Broker,,,909985,O-BOCO-CBRB,Coldwell Banker Realty,chris.mygatt@coloradohomes.com,"[{'number': '3034091500', 'type': 'Office', 'primary': True, 'ext': None}, {'number': '3034496969', 'type': 'Fax', 'primary': False, 'ext': None}]","Charter School Institute School District, Adams 12 Five Star Schools School District",http://ap.rdcpix.com/58dfa9a2479bad52a0f51d41181eb050l-b4258136694od-w480_h360_x2.webp?w=1080&q=75,"http://ap.rdcpix.com/58dfa9a2479bad52a0f51d41181eb050l-b4258136694od-w480_h360_x2.webp?w=1080&q=75, http://ap.rdcpix.com/58dfa9a2479bad52a0f51d41181eb050l-b3147149157od-w480_h360_x2.webp?w=1080&q=75, http://ap.rdcpix.com/58dfa9a2479bad52a0f51d41181eb050l-b2853775814od-w480_h360_x2.webp?w=1080&q=75, http://ap.rdcpix.com/58dfa9a2479bad52a0f51d41181eb050l-b1486994065od-w480_h360_x2.webp?w=1080&q=75, http://ap.rdcpix.com/58dfa9a2479bad52a0f51d41181eb050l-b1772021506od-w480_h360_x2.webp?w=1080&q=75, http://ap.rdcpix.com/58dfa9a2479bad52a0f51d41181eb050l-b2075488556od-w480_h360_x2.webp?w=1080&q=75, http://ap.rdcpix.com/58dfa9a2479bad52a0f51d41181eb050l-b4281067836od-w480_h360_x2.webp?w=1080&q=75, http://ap.rdcpix.com/58dfa9a2479bad52a0f51d41181eb050l-b730847968od-w480_h360_x2.webp?w=1080&q=75, http://ap.rdcpix.com/58dfa9a2479bad52a0f51d41181eb050l-b3886030807od-w480_h360_x2.webp?w=1080&q=75, http://ap.rdcpix.com/58dfa9a2479bad52a0f51d41181eb050l-b138543352od-w480_h360_x2.webp?w=1080&q=75, http://ap.rdcpix.com/58dfa9a2479bad52a0f51d41181eb050l-b1191566404od-w480_h360_x2.webp?w=1080&q=75, http://ap.rdcpix.com/58dfa9a2479bad52a0f51d41181eb050l-b3699783054od-w480_h360_x2.webp?w=1080&q=75, http://ap.rdcpix.com/58dfa9a2479bad52a0f51d41181eb050l-b3030768527od-w480_h360_x2.webp?w=1080&q=75, http://ap.rdcpix.com/58dfa9a2479bad52a0f51d41181eb050l-b2504634082od-w480_h360_x2.webp?w=1080&q=75, http://ap.rdcpix.com/58dfa9a2479bad52a0f51d41181eb050l-b1437999319od-w480_h360_x2.webp?w=1080&q=75, http://ap.rdcpix.com/58dfa9a2479bad52a0f51d41181eb050l-b1651634674od-w480_h360_x2.webp?w=1080&q=75, http://ap.rdcpix.com/58dfa9a2479bad52a0f51d41181eb050l-b4291431921od-w480_h360_x2.webp?w=1080&q=75, http://ap.rdcpix.com/58dfa9a2479bad52a0f51d41181eb050l-b2829092668od-w480_h360_x2.webp?w=1080&q=75, http://ap.rdcpix.com/58dfa9a2479bad52a0f51d41181eb050l-b51586889od-w480_h360_x2.webp?w=1080&q=75, http://ap.rdcpix.com/58dfa9a2479bad52a0f51d41181eb050l-b2155422729od-w480_h360_x2.webp?w=1080&q=75, http://ap.rdcpix.com/58dfa9a2479bad52a0f51d41181eb050l-b848697862od-w480_h360_x2.webp?w=1080&q=75, http://ap.rdcpix.com/58dfa9a2479bad52a0f51d41181eb050l-b579784875od-w480_h360_x2.webp?w=1080&q=75, http://ap.rdcpix.com/58dfa9a2479bad52a0f51d41181eb050l-b1026322998od-w480_h360_x2.webp?w=1080&q=75, http://ap.rdcpix.com/58dfa9a2479bad52a0f51d41181eb050l-b3628874240od-w480_h360_x2.webp?w=1080&q=75, http://ap.rdcpix.com/58dfa9a2479bad52a0f51d41181eb050l-b2915050116od-w480_h360_x2.webp?w=1080&q=75, http://ap.rdcpix.com/58dfa9a2479bad52a0f51d41181eb050l-b782085492od-w480_h360_x2.webp?w=1080&q=75, http://ap.rdcpix.com/58dfa9a2479bad52a0f51d41181eb050l-b103961306od-w480_h360_x2.webp?w=1080&q=75, http://ap.rdcpix.com/58dfa9a2479bad52a0f51d41181eb050l-b2973900236od-w480_h360_x2.webp?w=1080&q=75, http://ap.rdcpix.com/58dfa9a2479bad52a0f51d41181eb050l-b562426718od-w480_h360_x2.webp?w=1080&q=75, http://ap.rdcpix.com/58dfa9a2479bad52a0f51d41181eb050l-b3092576273od-w480_h360_x2.webp?w=1080&q=75"
https://www.realtor.com/realestateandhomes-detail/11052-Zephyr-St_Broomfield_CO_80021_M13895-56371,1389556371,2977836384,DVCO,3638057,FOR_SALE,"Stunning 4-Bedroom Home in Prestigious Green Knolls Welcome to this beautiful 4-bedroom, 3.5-bathroom home nestled in the highly sought-after Green Knolls subdivision of Broomfield. Boasting 3, 300 square feet of thoughtfully designed living space, this home offers the perfect blend of elegance, comfort, and modern convenience. Key Features: Spacious & Open Floor Plan Expansive living areas with abundant natural light. Gourmet Kitchen Equipped with high-end appliances, ample cabinetry, and an oversized island, perfect for entertaining. Luxurious Primary Suite A private retreat featuring a spa-like en-suite bathroom and generous walk-in closet. Finished Basement Extra space for a home theater, gym, or guest suite. Beautiful Outdoor Living Enjoy a well-manicured backyard and expansive yard, ideal for gatherings and relaxation. Prime Location Close to top schools, scenic parks, shopping, and dining. With its exceptional location and features, this home is a rare gem in Broomfield. Dont miss your chance to own in one of the areas most prestigious neighborhoods! Schedule your private showing today!",SINGLE_FAMILY,11052 Zephyr St,11052 Zephyr St,,Broomfield,CO,80021,4,3,1,3489,1988,3,885000,,,2025-01-31,600000,2020-08-04,39664,790000,3084,"[{'year': 2022, 'tax': 3084, 'assessment': {'building': 29511, 'land': 10153, 'total': 39664}}, {'year': 2021, 'tax': 3129, 'assessment': {'building': 30360, 'land': 10445, 'total': 40805}}, {'year': 2020, 'tax': 2904, 'assessment': {'building': 27296, 'land': 10782, 'total': 38078}}, {'year': 2019, 'tax': 2857, 'assessment': {'building': 27296, 'land': 10782, 'total': 38078}}, {'year': 2018, 'tax': 2559, 'assessment': {'building': 24254, 'land': 8722, 'total': 32976}}, {'year': 2017, 'tax': 2292, 'assessment': {'building': 24254, 'land': 8722, 'total': 32976}}, {'year': 2016, 'tax': 2370, 'assessment': {'building': 23386, 'land': 8261, 'total': 31647}}, {'year': 2015, 'tax': 2403, 'assessment': {'building': 23386, 'land': 8261, 'total': 31647}}, {'year': 2014, 'tax': 2218, 'assessment': {'building': 20401, 'land': 7209, 'total': 27610}}, {'year': 2013, 'tax': 2223, 'assessment': {'building': 20401, 'land': 7209, 'total': 27610}}, {'year': 2011, 'tax': 2177, 'assessment': {'building': 20983, 'land': 7166, 'total': 28149}}, {'year': 2009, 'tax': 2123, 'assessment': {'building': 20983, 'land': 7166, 'total': 28149}}, {'year': 2008, 'tax': 2156, 'assessment': {'building': 19700, 'land': 7980, 'total': 27680}}, {'year': 2007, 'tax': 2150, 'assessment': {'building': 20070, 'land': 7980, 'total': 28050}}, {'year': 2006, 'tax': 2183, 'assessment': {'building': 20040, 'land': 8090, 'total': 28130}}]",False,12632,254,39.896565,-105.085795,"Green Knolls, West Westminster",Jefferson,08059,2,31,4,3906749,Cody Notch,notchrealty@gmail.com,"[{'ext': None, 'primary': True, 'type': 'Office', 'number': '7202201268'}]",A-DVCO-359723538,,,Resident Realty,,,,O-DVCO-02884,Resident Realty South Metro,chris@denverhomeexperts.com,"[{'number': '(303) 325-5461', 'type': 'Mobile', 'primary': True, 'ext': None}]",Jefferson County R-1 School District,http://ap.rdcpix.com/6a7946fbe36fdbb16be781f5aeac5b1cl-m2752758420od-w480_h360_x2.webp?w=1080&q=75,"http://ap.rdcpix.com/6a7946fbe36fdbb16be781f5aeac5b1cl-m2752758420od-w480_h360_x2.webp?w=1080&q=75, http://ap.rdcpix.com/6a7946fbe36fdbb16be781f5aeac5b1cl-m1892922127od-w480_h360_x2.webp?w=1080&q=75, http://ap.rdcpix.com/6a7946fbe36fdbb16be781f5aeac5b1cl-m1047354601od-w480_h360_x2.webp?w=1080&q=75, http://ap.rdcpix.com/6a7946fbe36fdbb16be781f5aeac5b1cl-m1320496025od-w480_h360_x2.webp?w=1080&q=75, http://ap.rdcpix.com/6a7946fbe36fdbb16be781f5aeac5b1cl-m1670911919od-w480_h360_x2.webp?w=1080&q=75, http://ap.rdcpix.com/6a7946fbe36fdbb16be781f5aeac5b1cl-m3558052001od-w480_h360_x2.webp?w=1080&q=75, http://ap.rdcpix.com/6a7946fbe36fdbb16be781f5aeac5b1cl-m2185542449od-w480_h360_x2.webp?w=1080&q=75, http://ap.rdcpix.com/6a7946fbe36fdbb16be781f5aeac5b1cl-m3186121753od-w480_h360_x2.webp?w=1080&q=75, http://ap.rdcpix.com/6a7946fbe36fdbb16be781f5aeac5b1cl-m2825129734od-w480_h360_x2.webp?w=1080&q=75, http://ap.rdcpix.com/6a7946fbe36fdbb16be781f5aeac5b1cl-m2862174688od-w480_h360_x2.webp?w=1080&q=75, http://ap.rdcpix.com/6a7946fbe36fdbb16be781f5aeac5b1cl-m3565983020od-w480_h360_x2.webp?w=1080&q=75, http://ap.rdcpix.com/6a7946fbe36fdbb16be781f5aeac5b1cl-m3910095354od-w480_h360_x2.webp?w=1080&q=75, http://ap.rdcpix.com/6a7946fbe36fdbb16be781f5aeac5b1cl-m2351951480od-w480_h360_x2.webp?w=1080&q=75, http://ap.rdcpix.com/6a7946fbe36fdbb16be781f5aeac5b1cl-m1076530575od-w480_h360_x2.webp?w=1080&q=75, http://ap.rdcpix.com/6a7946fbe36fdbb16be781f5aeac5b1cl-m4211674158od-w480_h360_x2.webp?w=1080&q=75, http://ap.rdcpix.com/6a7946fbe36fdbb16be781f5aeac5b1cl-m3449293141od-w480_h360_x2.webp?w=1080&q=75, http://ap.rdcpix.com/6a7946fbe36fdbb16be781f5aeac5b1cl-m3835012805od-w480_h360_x2.webp?w=1080&q=75, http://ap.rdcpix.com/6a7946fbe36fdbb16be781f5aeac5b1cl-m4047797488od-w480_h360_x2.webp?w=1080&q=75, http://ap.rdcpix.com/6a7946fbe36fdbb16be781f5aeac5b1cl-m1561528739od-w480_h360_x2.webp?w=1080&q=75"
