property_url,property_id,listing_id,mls,mls_id,status,text,style,full_street_line,street,unit,city,state,zip_code,beds,full_baths,half_baths,sqft,year_built,days_on_mls,list_price,list_price_min,list_price_max,list_date,sold_price,last_sold_date,assessed_value,estimated_value,tax,tax_history,new_construction,lot_sqft,price_per_sqft,latitude,longitude,neighborhoods,county,fips_code,stories,hoa_fee,parking_garage,agent_id,agent_name,agent_email,agent_phones,agent_mls_set,agent_nrds_id,broker_id,broker_name,builder_id,builder_name,office_id,office_mls_set,office_name,office_email,office_phones,nearby_schools,primary_photo,alt_photos
https://www.realtor.com/realestateandhomes-detail/4831-Sunshine-Pl_Broomfield_CO_80023_M98303-85856,9830385856,2977463889,DVCO,7711742,FOR_SALE,"55+ Stunning Home in Anthem Ranch Welcome to your dream home in the desirable Anthem Ranch community! This beautifully updated 3-bedroom, 2-bathroom residence combines comfort, style, and modern conveniences for a truly exceptional living experience. As you step inside, youre greeted by high ceilings and an abundance of natural light that creates a warm and inviting atmosphere. The open floor plan flows seamlessly, making it perfect for both entertaining and everyday living. The modern kitchen is a chef's delight, featuring brand-new appliances, including a refrigerator, microwave, and oven. With ample counter space and cabinetry, you'll have everything you need to whip up your favorite meals. Retreat to the spacious primary suite, complete with an en-suite bathroom, offering a serene space to unwind. The additional bedrooms are generously sized, perfect for family, guests, or a home office. Recent upgrades include new carpet and stylish laminate flooring throughout the home, ensuring a fresh and contemporary feel. Plus, this home has been professionally cleaned, Plus it has a Wheel chair lift/elevator, ready for you to move in and enjoy! Step outside to your expansive patio, with an electric awning to offer shade for the summer days, ideal for hosting summer barbecues or simply enjoying a quiet evening under the stars. The low-maintenance yard gives you more time to relax and enjoy the community amenities. As a resident of Anthem Ranch, youll have access to a fantastic clubhouse that offers a variety of activities and events, enhancing your lifestyle and creating a true sense of community. Enjoy walking trails, parks, and nearby shopping, all while being part of a vibrant neighborhood. Dont miss the opportunity to make this stunning home yours. Schedule a showing today and experience all that Anthem Ranch has to offer!",SINGLE_FAMILY,4831 Sunshine Pl,4831 Sunshine Pl,,Broomfield,CO,80023,3,2,,1800,2012,13,720000,,,2025-01-21,344328,2012-05-31,35510,725824,4908,"[{'year': 2022, 'tax': 4908, 'assessment': {'building': 25430, 'land': 10080, 'total': 35510}}, {'year': 2021, 'tax': 5064, 'assessment': {'building': 26160, 'land': 10370, 'total': 36530}}, {'year': 2020, 'tax': 4810, 'assessment': {'building': 24600, 'land': 9650, 'total': 34250}}, {'year': 2019, 'tax': 4830, 'assessment': {'building': 24600, 'land': 9650, 'total': 34250}}, {'year': 2018, 'tax': 4678, 'assessment': {'building': 24530, 'land': 7200, 'total': 31730}}, {'year': 2017, 'tax': 4376, 'assessment': {'building': 24530, 'land': 7200, 'total': 31730}}, {'year': 2016, 'tax': 4398, 'assessment': {'building': 22320, 'land': 7960, 'total': 30280}}, {'year': 2015, 'tax': 4579, 'assessment': {'building': 22320, 'land': 7960, 'total': 30280}}, {'year': 2014, 'tax': 4128, 'assessment': {'building': 17730, 'land': 7960, 'total': 25690}}, {'year': 2013, 'tax': 4029, 'assessment': {'building': 17730, 'land': 7960, 'total': 25690}}, {'year': 2011, 'tax': 1559, 'assessment': {'building': 1690, 'land': 7040, 'total': 8730}}, {'year': 2010, 'tax': 6, 'assessment': {'building': None, 'land': 10060, 'total': 10060}}, {'year': 2009, 'tax': 6, 'assessment': {'building': None, 'land': 10, 'total': 10}}, {'year': 2008, 'tax': 1725, 'assessment': {'building': None, 'land': 11320, 'total': 11320}}, {'year': 2007, 'tax': 13, 'assessment': {'building': None, 'land': 60, 'total': 60}}]",False,9466,400,39.985889,-105.048701,Anthem,Broomfield,08014,1,248,2,,Bill Orsborn,billcohomes@gmail.com,"[{'ext': None, 'primary': True, 'type': None, 'number': '3038951636'}]",A-DVCO-2009518609,,,,,,3646872,O-DVCO-M7513,Realty One Group Five Star,nfo@rogfivestar.com,"[{'number': '3033778100', 'type': 'Office', 'primary': True, 'ext': None}]",Adams 12 Five Star Schools School District,http://ap.rdcpix.com/25644f762131a1511ba1ed781fa2bb90l-m3519298902od-w480_h360_x2.webp?w=1080&q=75,"http://ap.rdcpix.com/25644f762131a1511ba1ed781fa2bb90l-m3519298902od-w480_h360_x2.webp?w=1080&q=75, http://ap.rdcpix.com/25644f762131a1511ba1ed781fa2bb90l-m2764090033od-w480_h360_x2.webp?w=1080&q=75, http://ap.rdcpix.com/25644f762131a1511ba1ed781fa2bb90l-m4073823973od-w480_h360_x2.webp?w=1080&q=75, http://ap.rdcpix.com/25644f762131a1511ba1ed781fa2bb90l-m618534717od-w480_h360_x2.webp?w=1080&q=75, http://ap.rdcpix.com/25644f762131a1511ba1ed781fa2bb90l-m917698790od-w480_h360_x2.webp?w=1080&q=75, http://ap.rdcpix.com/25644f762131a1511ba1ed781fa2bb90l-m984313443od-w480_h360_x2.webp?w=1080&q=75, http://ap.rdcpix.com/25644f762131a1511ba1ed781fa2bb90l-m3144254511od-w480_h360_x2.webp?w=1080&q=75, http://ap.rdcpix.com/25644f762131a1511ba1ed781fa2bb90l-m513834344od-w480_h360_x2.webp?w=1080&q=75, http://ap.rdcpix.com/25644f762131a1511ba1ed781fa2bb90l-m803519009od-w480_h360_x2.webp?w=1080&q=75, http://ap.rdcpix.com/25644f762131a1511ba1ed781fa2bb90l-m4168110141od-w480_h360_x2.webp?w=1080&q=75, http://ap.rdcpix.com/25644f762131a1511ba1ed781fa2bb90l-m4239204239od-w480_h360_x2.webp?w=1080&q=75, http://ap.rdcpix.com/25644f762131a1511ba1ed781fa2bb90l-m825902790od-w480_h360_x2.webp?w=1080&q=75, http://ap.rdcpix.com/25644f762131a1511ba1ed781fa2bb90l-m1753385663od-w480_h360_x2.webp?w=1080&q=75, http://ap.rdcpix.com/25644f762131a1511ba1ed781fa2bb90l-m3495142471od-w480_h360_x2.webp?w=1080&q=75, http://ap.rdcpix.com/25644f762131a1511ba1ed781fa2bb90l-m154078624od-w480_h360_x2.webp?w=1080&q=75, http://ap.rdcpix.com/25644f762131a1511ba1ed781fa2bb90l-m162293058od-w480_h360_x2.webp?w=1080&q=75, http://ap.rdcpix.com/25644f762131a1511ba1ed781fa2bb90l-m605783959od-w480_h360_x2.webp?w=1080&q=75, http://ap.rdcpix.com/25644f762131a1511ba1ed781fa2bb90l-m4004826973od-w480_h360_x2.webp?w=1080&q=75, http://ap.rdcpix.com/25644f762131a1511ba1ed781fa2bb90l-m2788785435od-w480_h360_x2.webp?w=1080&q=75, http://ap.rdcpix.com/25644f762131a1511ba1ed781fa2bb90l-m1068435736od-w480_h360_x2.webp?w=1080&q=75, http://ap.rdcpix.com/25644f762131a1511ba1ed781fa2bb90l-m3626018849od-w480_h360_x2.webp?w=1080&q=75, http://ap.rdcpix.com/25644f762131a1511ba1ed781fa2bb90l-m738727383od-w480_h360_x2.webp?w=1080&q=75, http://ap.rdcpix.com/25644f762131a1511ba1ed781fa2bb90l-m635824097od-w480_h360_x2.webp?w=1080&q=75, http://ap.rdcpix.com/25644f762131a1511ba1ed781fa2bb90l-m3852931011od-w480_h360_x2.webp?w=1080&q=75, http://ap.rdcpix.com/25644f762131a1511ba1ed781fa2bb90l-m2033771154od-w480_h360_x2.webp?w=1080&q=75, http://ap.rdcpix.com/25644f762131a1511ba1ed781fa2bb90l-m1327167768od-w480_h360_x2.webp?w=1080&q=75, http://ap.rdcpix.com/25644f762131a1511ba1ed781fa2bb90l-m3097060973od-w480_h360_x2.webp?w=1080&q=75, http://ap.rdcpix.com/25644f762131a1511ba1ed781fa2bb90l-m3903273973od-w480_h360_x2.webp?w=1080&q=75, http://ap.rdcpix.com/25644f762131a1511ba1ed781fa2bb90l-m3431434485od-w480_h360_x2.webp?w=1080&q=75, http://ap.rdcpix.com/25644f762131a1511ba1ed781fa2bb90l-m1296681974od-w480_h360_x2.webp?w=1080&q=75, http://ap.rdcpix.com/25644f762131a1511ba1ed781fa2bb90l-m4065804008od-w480_h360_x2.webp?w=1080&q=75, http://ap.rdcpix.com/25644f762131a1511ba1ed781fa2bb90l-m3310068783od-w480_h360_x2.webp?w=1080&q=75, http://ap.rdcpix.com/25644f762131a1511ba1ed781fa2bb90l-m466527282od-w480_h360_x2.webp?w=1080&q=75, http://ap.rdcpix.com/25644f762131a1511ba1ed781fa2bb90l-m63099891od-w480_h360_x2.webp?w=1080&q=75, http://ap.rdcpix.com/25644f762131a1511ba1ed781fa2bb90l-m837962217od-w480_h360_x2.webp?w=1080&q=75, http://ap.rdcpix.com/25644f762131a1511ba1ed781fa2bb90l-m3214600190od-w480_h360_x2.webp?w=1080&q=75, http://ap.rdcpix.com/25644f762131a1511ba1ed781fa2bb90l-m747379391od-w480_h360_x2.webp?w=1080&q=75, http://ap.rdcpix.com/25644f762131a1511ba1ed781fa2bb90l-m2999646779od-w480_h360_x2.webp?w=1080&q=75, http://ap.rdcpix.com/25644f762131a1511ba1ed781fa2bb90l-m261676857od-w480_h360_x2.webp?w=1080&q=75, http://ap.rdcpix.com/25644f762131a1511ba1ed781fa2bb90l-m556917969od-w480_h360_x2.webp?w=1080&q=75, http://ap.rdcpix.com/25644f762131a1511ba1ed781fa2bb90l-m2995744049od-w480_h360_x2.webp?w=1080&q=75, http://ap.rdcpix.com/25644f762131a1511ba1ed781fa2bb90l-m4213846783od-w480_h360_x2.webp?w=1080&q=75, http://ap.rdcpix.com/25644f762131a1511ba1ed781fa2bb90l-m585864271od-w480_h360_x2.webp?w=1080&q=75, http://ap.rdcpix.com/25644f762131a1511ba1ed781fa2bb90l-m520354009od-w480_h360_x2.webp?w=1080&q=75, http://ap.rdcpix.com/25644f762131a1511ba1ed781fa2bb90l-m4194873417od-w480_h360_x2.webp?w=1080&q=75, http://ap.rdcpix.com/25644f762131a1511ba1ed781fa2bb90l-m2738721420od-w480_h360_x2.webp?w=1080&q=75, http://ap.rdcpix.com/25644f762131a1511ba1ed781fa2bb90l-m2271608725od-w480_h360_x2.webp?w=1080&q=75"
https://www.realtor.com/realestateandhomes-detail/10432-Hoyt-St_Broomfield_CO_80021_M24414-78577,2441478577,2977211438,DVCO,3131876,PENDING,"Charming split-level home with modern upgrades in the desirable Walnut Grove neighborhood! This 3-bedroom, 2-bath property features a beautifully updated kitchen with soft-close cherry cabinets, granite tile counters, sleek Samsung smart appliances, a pantry, breakfast bar, and tile floors. The inviting family room includes a wood-burning fireplace, while the lower level offers a cozy bedroom and bathroom, perfect for guests or additional living space. Upstairs, the primary suite boasts a walk-in closet and private access to a shared full bathroom, with a secondary bedroom completing the level. The partially finished basement includes a bonus room and laundry area. The large, flat backyard is perfect for outdoor living, with a lush lawn, built in firepit, irrigated garden boxes, a paver patio, and a storage shed. Recent updates throughout the home include new lighting fixtures, faucets, cabinet hardware, and a stylish bathroom vanity. Situated in a top-rated school district, the property is minutes from Standley Lake High School and surrounded by open spaces, parks, shops, and convenient access to Denver and Boulder via US 36.",SINGLE_FAMILY,10432 Hoyt St,10432 Hoyt St,,Broomfield,CO,80021,3,1,,1656,1977,20,565000,,,2025-01-14,371000,2017-10-11,26329,565401,2047,"[{'year': 2022, 'tax': 2047, 'assessment': {'building': 17827, 'land': 8502, 'total': 26329}}, {'year': 2021, 'tax': 2077, 'assessment': {'building': 18340, 'land': 8747, 'total': 27087}}, {'year': 2020, 'tax': 1945, 'assessment': {'building': 16830, 'land': 8684, 'total': 25514}}, {'year': 2019, 'tax': 1914, 'assessment': {'building': 16830, 'land': 8684, 'total': 25514}}, {'year': 2018, 'tax': 1660, 'assessment': {'building': 15057, 'land': 6336, 'total': 21393}}, {'year': 2017, 'tax': 1486, 'assessment': {'building': 15057, 'land': 6336, 'total': 21393}}, {'year': 2016, 'tax': 1404, 'assessment': {'building': 12513, 'land': 6233, 'total': 18746}}, {'year': 2015, 'tax': 1423, 'assessment': {'building': 12513, 'land': 6233, 'total': 18746}}, {'year': 2014, 'tax': 1188, 'assessment': {'building': 9218, 'land': 5572, 'total': 14790}}, {'year': 2013, 'tax': 1191, 'assessment': {'building': 9218, 'land': 5572, 'total': 14790}}, {'year': 2011, 'tax': 1147, 'assessment': {'building': 9902, 'land': 4935, 'total': 14837}}, {'year': 2009, 'tax': 1143, 'assessment': {'building': 9902, 'land': 4935, 'total': 14837}}, {'year': 2008, 'tax': 1186, 'assessment': {'building': 9500, 'land': 5410, 'total': 14910}}, {'year': 2007, 'tax': 1183, 'assessment': {'building': 10030, 'land': 5410, 'total': 15440}}, {'year': 2006, 'tax': 1215, 'assessment': {'building': 10440, 'land': 5220, 'total': 15660}}]",False,7379,341,39.886672,-105.103374,"West Westminster, Walnut Grove",Jefferson,08059,2,0,2,1832090,TRELORA Team,denverlisting@trelora.com,"[{'ext': None, 'primary': True, 'type': 'Office', 'number': '3039001377'}]",A-DVCO-606344091,,3611162,Trelora Real Estate,,,3884116,O-DVCO-JTR02,Trelora Denver,customerservice@trelora.com,"[{'number': '3038863000', 'type': 'Office', 'primary': True, 'ext': None}]",Jefferson County R-1 School District,http://ap.rdcpix.com/0b028d1d2f5aca5d4356f3e7b75f0d66l-m3612980403od-w480_h360_x2.webp?w=1080&q=75,"http://ap.rdcpix.com/0b028d1d2f5aca5d4356f3e7b75f0d66l-m3612980403od-w480_h360_x2.webp?w=1080&q=75, http://ap.rdcpix.com/0b028d1d2f5aca5d4356f3e7b75f0d66l-m2144417062od-w480_h360_x2.webp?w=1080&q=75, http://ap.rdcpix.com/0b028d1d2f5aca5d4356f3e7b75f0d66l-m3147901109od-w480_h360_x2.webp?w=1080&q=75, http://ap.rdcpix.com/0b028d1d2f5aca5d4356f3e7b75f0d66l-m2300284922od-w480_h360_x2.webp?w=1080&q=75, http://ap.rdcpix.com/0b028d1d2f5aca5d4356f3e7b75f0d66l-m1097605277od-w480_h360_x2.webp?w=1080&q=75, http://ap.rdcpix.com/0b028d1d2f5aca5d4356f3e7b75f0d66l-m3167496496od-w480_h360_x2.webp?w=1080&q=75, http://ap.rdcpix.com/0b028d1d2f5aca5d4356f3e7b75f0d66l-m4257639560od-w480_h360_x2.webp?w=1080&q=75, http://ap.rdcpix.com/0b028d1d2f5aca5d4356f3e7b75f0d66l-m3549412551od-w480_h360_x2.webp?w=1080&q=75, http://ap.rdcpix.com/0b028d1d2f5aca5d4356f3e7b75f0d66l-m271013541od-w480_h360_x2.webp?w=1080&q=75, http://ap.rdcpix.com/0b028d1d2f5aca5d4356f3e7b75f0d66l-m2695813851od-w480_h360_x2.webp?w=1080&q=75, http://ap.rdcpix.com/0b028d1d2f5aca5d4356f3e7b75f0d66l-m2217999746od-w480_h360_x2.webp?w=1080&q=75, http://ap.rdcpix.com/0b028d1d2f5aca5d4356f3e7b75f0d66l-m2166208452od-w480_h360_x2.webp?w=1080&q=75, http://ap.rdcpix.com/0b028d1d2f5aca5d4356f3e7b75f0d66l-m3745612074od-w480_h360_x2.webp?w=1080&q=75, http://ap.rdcpix.com/0b028d1d2f5aca5d4356f3e7b75f0d66l-m773357970od-w480_h360_x2.webp?w=1080&q=75, http://ap.rdcpix.com/0b028d1d2f5aca5d4356f3e7b75f0d66l-m334136875od-w480_h360_x2.webp?w=1080&q=75, http://ap.rdcpix.com/0b028d1d2f5aca5d4356f3e7b75f0d66l-m2432055898od-w480_h360_x2.webp?w=1080&q=75, http://ap.rdcpix.com/0b028d1d2f5aca5d4356f3e7b75f0d66l-m3358490033od-w480_h360_x2.webp?w=1080&q=75, http://ap.rdcpix.com/0b028d1d2f5aca5d4356f3e7b75f0d66l-m3465241663od-w480_h360_x2.webp?w=1080&q=75, http://ap.rdcpix.com/0b028d1d2f5aca5d4356f3e7b75f0d66l-m767325748od-w480_h360_x2.webp?w=1080&q=75, http://ap.rdcpix.com/0b028d1d2f5aca5d4356f3e7b75f0d66l-m2067527139od-w480_h360_x2.webp?w=1080&q=75, http://ap.rdcpix.com/0b028d1d2f5aca5d4356f3e7b75f0d66l-m416404488od-w480_h360_x2.webp?w=1080&q=75, http://ap.rdcpix.com/0b028d1d2f5aca5d4356f3e7b75f0d66l-m4152657302od-w480_h360_x2.webp?w=1080&q=75, http://ap.rdcpix.com/0b028d1d2f5aca5d4356f3e7b75f0d66l-m3301219654od-w480_h360_x2.webp?w=1080&q=75, http://ap.rdcpix.com/0b028d1d2f5aca5d4356f3e7b75f0d66l-m4249727592od-w480_h360_x2.webp?w=1080&q=75, http://ap.rdcpix.com/0b028d1d2f5aca5d4356f3e7b75f0d66l-m3952507295od-w480_h360_x2.webp?w=1080&q=75, http://ap.rdcpix.com/0b028d1d2f5aca5d4356f3e7b75f0d66l-m42177099od-w480_h360_x2.webp?w=1080&q=75, http://ap.rdcpix.com/0b028d1d2f5aca5d4356f3e7b75f0d66l-m280133986od-w480_h360_x2.webp?w=1080&q=75, http://ap.rdcpix.com/0b028d1d2f5aca5d4356f3e7b75f0d66l-m2438339501od-w480_h360_x2.webp?w=1080&q=75, http://ap.rdcpix.com/0b028d1d2f5aca5d4356f3e7b75f0d66l-m1092426277od-w480_h360_x2.webp?w=1080&q=75, http://ap.rdcpix.com/0b028d1d2f5aca5d4356f3e7b75f0d66l-m1070572958od-w480_h360_x2.webp?w=1080&q=75, http://ap.rdcpix.com/0b028d1d2f5aca5d4356f3e7b75f0d66l-m2745501996od-w480_h360_x2.webp?w=1080&q=75, http://ap.rdcpix.com/0b028d1d2f5aca5d4356f3e7b75f0d66l-m3525432672od-w480_h360_x2.webp?w=1080&q=75, http://ap.rdcpix.com/0b028d1d2f5aca5d4356f3e7b75f0d66l-m605040092od-w480_h360_x2.webp?w=1080&q=75"
https://www.realtor.com/realestateandhomes-detail/6716-W-97th-Cir_Broomfield_CO_80021_M14361-90587,1436190587,2977281308,DVCO,7239111,PENDING,"Stunning Updated 2-Story Home in Westcliff Community! With over 3, 500 square feet of living space, this home offers both modern luxury and exceptional functionality. MAIN FLOOR: As you step inside, youll be greeted by soaring vaulted ceilings in the entry, formal living room, and dining room, creating an open and airy atmosphere. The freshly painted interior and engineered hardwood flooring add a touch of elegance throughout. The spacious kitchen has been thoughtfully updated with brand new stainless steel appliances, sleek quartz countertops, and a new oversized sliding glass door leading to the private, oversized patio and backyardperfect for indoor-outdoor living. Adjacent to the kitchen is a cozy informal dining area and family room, all with vaulted ceilings. Youll also find a convenient half-bathroom and laundry room on this level. The MAIN FLOOR PRIMARY SUITE offers vaulted ceilings, a luxurious 5-piece en suite bathroom, and a walk-in closet. UPPER LEVEL: Upstairs, you'll find three additional spacious bedrooms and a well-appointed 4-piece bathroom. BASEMENT: The fully finished basement adds even more livable space, including a massive living room, two additional bedrooms, a 3/4 bathroom, and a utility roomperfect for guests or a home office. EXTERIOR/LOCATION: The home sits on a beautifully landscaped lot with a private, fenced backyardideal for entertaining. The attached 3-car garage provides plenty of room for vehicles and storage. Youll be within walking distance of the Westcliff Community Park, Westminster Sports Center, and the Niver Canal Trail. Plus, youre just minutes from Highway 36, making it an easy drive to either Denver or Boulderboth just 20 minutes away! This home is a rare find and wont last long!",SINGLE_FAMILY,6716 W 97th Cir,6716 W 97th Cir,,Broomfield,CO,80021,6,2,1,3735,1995,19,799000,,,2025-01-15,545000,2021-07-06,34061,730000,2648,"[{'year': 2022, 'tax': 2648, 'assessment': {'building': 25414, 'land': 8647, 'total': 34061}}, {'year': 2021, 'tax': 2139, 'assessment': {'building': 26145, 'land': 8896, 'total': 35041}}, {'year': 2020, 'tax': 1919, 'assessment': {'building': 24173, 'land': 8147, 'total': 32320}}, {'year': 2019, 'tax': 1889, 'assessment': {'building': 24173, 'land': 8147, 'total': 32320}}, {'year': 2018, 'tax': 1832, 'assessment': {'building': 23231, 'land': 7570, 'total': 30801}}, {'year': 2017, 'tax': 1640, 'assessment': {'building': 23231, 'land': 7570, 'total': 30801}}, {'year': 2016, 'tax': 1601, 'assessment': {'building': 23100, 'land': 6233, 'total': 29333}}, {'year': 2015, 'tax': 1623, 'assessment': {'building': 23100, 'land': 6233, 'total': 29333}}, {'year': 2014, 'tax': 1269, 'assessment': {'building': 18181, 'land': 5572, 'total': 23753}}, {'year': 2013, 'tax': 1271, 'assessment': {'building': 18181, 'land': 5572, 'total': 23753}}, {'year': 2011, 'tax': 1750, 'assessment': {'building': 17703, 'land': 4935, 'total': 22638}}, {'year': 2009, 'tax': 1757, 'assessment': {'building': 17703, 'land': 4935, 'total': 22638}}, {'year': 2008, 'tax': 1291, 'assessment': {'building': 16550, 'land': 6360, 'total': 22910}}, {'year': 2007, 'tax': 1288, 'assessment': {'building': 18400, 'land': 6360, 'total': 24760}}, {'year': 2006, 'tax': 1860, 'assessment': {'building': 17820, 'land': 6140, 'total': 23960}}]",False,6579,214,39.872969,-105.072932,"West Westminster, Westcliff, Westcliff and Cambridge",Jefferson,08059,2,70,3,3155747,Brianna Springer,brianna@madisonprops.com,"[{'ext': None, 'primary': True, 'type': 'Office', 'number': '(720) 272-9710'}]",A-DVCO-589580452,,3155712,MADISON AND COMPANY PROPERTIES - Broker,,,1386601,O-DVCO-MAD01,MADISON AND COMPANY PROPERTIES,info@madisonprops.com,"[{'number': '(303) 771-3850', 'type': 'Office', 'primary': True, 'ext': None}]",Jefferson County R-1 School District,http://ap.rdcpix.com/0210d4c8c1655bb25778fecb147611c6l-m1259403300od-w480_h360_x2.webp?w=1080&q=75,"http://ap.rdcpix.com/0210d4c8c1655bb25778fecb147611c6l-m1259403300od-w480_h360_x2.webp?w=1080&q=75, http://ap.rdcpix.com/0210d4c8c1655bb25778fecb147611c6l-m2066297903od-w480_h360_x2.webp?w=1080&q=75, http://ap.rdcpix.com/0210d4c8c1655bb25778fecb147611c6l-m329479652od-w480_h360_x2.webp?w=1080&q=75, http://ap.rdcpix.com/0210d4c8c1655bb25778fecb147611c6l-m2816366314od-w480_h360_x2.webp?w=1080&q=75, http://ap.rdcpix.com/0210d4c8c1655bb25778fecb147611c6l-m1501818885od-w480_h360_x2.webp?w=1080&q=75, http://ap.rdcpix.com/0210d4c8c1655bb25778fecb147611c6l-m3869538926od-w480_h360_x2.webp?w=1080&q=75, http://ap.rdcpix.com/0210d4c8c1655bb25778fecb147611c6l-m2356573804od-w480_h360_x2.webp?w=1080&q=75, http://ap.rdcpix.com/0210d4c8c1655bb25778fecb147611c6l-m799861723od-w480_h360_x2.webp?w=1080&q=75, http://ap.rdcpix.com/0210d4c8c1655bb25778fecb147611c6l-m380217509od-w480_h360_x2.webp?w=1080&q=75, http://ap.rdcpix.com/0210d4c8c1655bb25778fecb147611c6l-m3345880281od-w480_h360_x2.webp?w=1080&q=75, http://ap.rdcpix.com/0210d4c8c1655bb25778fecb147611c6l-m1981539403od-w480_h360_x2.webp?w=1080&q=75, http://ap.rdcpix.com/0210d4c8c1655bb25778fecb147611c6l-m83659175od-w480_h360_x2.webp?w=1080&q=75, http://ap.rdcpix.com/0210d4c8c1655bb25778fecb147611c6l-m3082846955od-w480_h360_x2.webp?w=1080&q=75, http://ap.rdcpix.com/0210d4c8c1655bb25778fecb147611c6l-m340792176od-w480_h360_x2.webp?w=1080&q=75, http://ap.rdcpix.com/0210d4c8c1655bb25778fecb147611c6l-m122406174od-w480_h360_x2.webp?w=1080&q=75, http://ap.rdcpix.com/0210d4c8c1655bb25778fecb147611c6l-m3256571815od-w480_h360_x2.webp?w=1080&q=75, http://ap.rdcpix.com/0210d4c8c1655bb25778fecb147611c6l-m3567829419od-w480_h360_x2.webp?w=1080&q=75, http://ap.rdcpix.com/0210d4c8c1655bb25778fecb147611c6l-m2143599919od-w480_h360_x2.webp?w=1080&q=75, http://ap.rdcpix.com/0210d4c8c1655bb25778fecb147611c6l-m2825141524od-w480_h360_x2.webp?w=1080&q=75, http://ap.rdcpix.com/0210d4c8c1655bb25778fecb147611c6l-m3946047929od-w480_h360_x2.webp?w=1080&q=75, http://ap.rdcpix.com/0210d4c8c1655bb25778fecb147611c6l-m2276955939od-w480_h360_x2.webp?w=1080&q=75, http://ap.rdcpix.com/0210d4c8c1655bb25778fecb147611c6l-m363028648od-w480_h360_x2.webp?w=1080&q=75, http://ap.rdcpix.com/0210d4c8c1655bb25778fecb147611c6l-m4049882800od-w480_h360_x2.webp?w=1080&q=75, http://ap.rdcpix.com/0210d4c8c1655bb25778fecb147611c6l-m303922747od-w480_h360_x2.webp?w=1080&q=75, http://ap.rdcpix.com/0210d4c8c1655bb25778fecb147611c6l-m1723657279od-w480_h360_x2.webp?w=1080&q=75, http://ap.rdcpix.com/0210d4c8c1655bb25778fecb147611c6l-m526917409od-w480_h360_x2.webp?w=1080&q=75, http://ap.rdcpix.com/0210d4c8c1655bb25778fecb147611c6l-m857838642od-w480_h360_x2.webp?w=1080&q=75, http://ap.rdcpix.com/0210d4c8c1655bb25778fecb147611c6l-m4280607529od-w480_h360_x2.webp?w=1080&q=75, http://ap.rdcpix.com/0210d4c8c1655bb25778fecb147611c6l-m3379318099od-w480_h360_x2.webp?w=1080&q=75, http://ap.rdcpix.com/0210d4c8c1655bb25778fecb147611c6l-m376902595od-w480_h360_x2.webp?w=1080&q=75, http://ap.rdcpix.com/0210d4c8c1655bb25778fecb147611c6l-m597374647od-w480_h360_x2.webp?w=1080&q=75, http://ap.rdcpix.com/0210d4c8c1655bb25778fecb147611c6l-m2177458842od-w480_h360_x2.webp?w=1080&q=75, http://ap.rdcpix.com/0210d4c8c1655bb25778fecb147611c6l-m3308061644od-w480_h360_x2.webp?w=1080&q=75, http://ap.rdcpix.com/0210d4c8c1655bb25778fecb147611c6l-m1393268163od-w480_h360_x2.webp?w=1080&q=75, http://ap.rdcpix.com/0210d4c8c1655bb25778fecb147611c6l-m4107708838od-w480_h360_x2.webp?w=1080&q=75, http://ap.rdcpix.com/0210d4c8c1655bb25778fecb147611c6l-m3022527098od-w480_h360_x2.webp?w=1080&q=75, http://ap.rdcpix.com/0210d4c8c1655bb25778fecb147611c6l-m884685385od-w480_h360_x2.webp?w=1080&q=75, http://ap.rdcpix.com/0210d4c8c1655bb25778fecb147611c6l-m862424472od-w480_h360_x2.webp?w=1080&q=75, http://ap.rdcpix.com/0210d4c8c1655bb25778fecb147611c6l-m1096414055od-w480_h360_x2.webp?w=1080&q=75, http://ap.rdcpix.com/0210d4c8c1655bb25778fecb147611c6l-m3275704281od-w480_h360_x2.webp?w=1080&q=75, http://ap.rdcpix.com/0210d4c8c1655bb25778fecb147611c6l-m602075654od-w480_h360_x2.webp?w=1080&q=75, http://ap.rdcpix.com/0210d4c8c1655bb25778fecb147611c6l-m3816998237od-w480_h360_x2.webp?w=1080&q=75, http://ap.rdcpix.com/0210d4c8c1655bb25778fecb147611c6l-m2749055894od-w480_h360_x2.webp?w=1080&q=75, http://ap.rdcpix.com/0210d4c8c1655bb25778fecb147611c6l-m313790558od-w480_h360_x2.webp?w=1080&q=75"
