property_url,property_id,listing_id,mls,mls_id,status,text,style,full_street_line,street,unit,city,state,zip_code,beds,full_baths,half_baths,sqft,year_built,days_on_mls,list_price,list_price_min,list_price_max,list_date,sold_price,last_sold_date,assessed_value,estimated_value,tax,tax_history,new_construction,lot_sqft,price_per_sqft,latitude,longitude,neighborhoods,county,fips_code,stories,hoa_fee,parking_garage,agent_id,agent_name,agent_email,agent_phones,agent_mls_set,agent_nrds_id,broker_id,broker_name,builder_id,builder_name,office_id,office_mls_set,office_name,office_email,office_phones,nearby_schools,primary_photo,alt_photos
https://www.realtor.com/realestateandhomes-detail/3520-W-95th-Ave_Westminster_CO_80031_M25740-82356,2574082356,2977874199,DVCO,6265477,FOR_SALE,"Welcome to 3520 W 95th Ave, a beautifully remodeled 4-bedroom, 2-bathroom single-family home in the great city of Westminster, COWITH NO HOA! With a well-designed layout and stylish upgrades, this home is move-in ready and ideal for those seeking both convenience and space. As you step inside, youll be welcomed by a bright and airy open-concept main level, where the kitchen, dining, and living areas flow together effortlessly perfect for hosting guests or enjoying daily life. Down the hall, youll find the primary bedroom, a second bedroom, and a full bathroom, offering comfortable living quarters on the main floor. The fully finished basement expands the homes functionality, featuring two additional bedrooms, a second bathroom, a secondary living area, and a flexible bonus room that can be used as a media space, home office, or extra storage. Outside, this property offers ample parking with a newly poured decorative concrete driveway that fits up to four vehicles, as well as fresh sidewalks around the home. The spacious backyard includes a new patio, providing a fantastic foundation for outdoor entertaining, gardening, or creating your own personal retreat. Conveniently located just minutes from schools (elementary, middle, and high), downtown Westminster, shopping, dining, and everyday essentials, this home also boasts quick access to major highways, just a mile away. Plus, for golf enthusiasts, Legacy Ridge Golf Course is only five minutes away! Dont miss the chance to own this stunning home in a prime locationschedule your showing today! PLEASE NOTE: THIS HOME QUALIFIES FOR SPECIAL LOAN PROGRAMS AS LOW AS 3% DOWN/NO MORTGAGE INSURANCE (INQUIRE WITH LISTING AGENT FOR MORE INFORMATION)",SINGLE_FAMILY,3520 W 95th Ave,3520 W 95th Ave,,Westminster,CO,80031,4,2,,1850,1968,1,525000,,,2025-02-02,177057,2003-03-17,21220,399182,2154,"[{'year': 2022, 'tax': 2154, 'assessment': {'building': 15030, 'land': 6190, 'total': 21220}}, {'year': 2021, 'tax': 2217, 'assessment': {'building': 15460, 'land': 6360, 'total': 21820}}, {'year': 2020, 'tax': 2249, 'assessment': {'building': 15510, 'land': 6360, 'total': 21870}}, {'year': 2019, 'tax': 2245, 'assessment': {'building': 15510, 'land': 6360, 'total': 21870}}, {'year': 2018, 'tax': 1648, 'assessment': {'building': 9480, 'land': 6480, 'total': 15960}}, {'year': 2017, 'tax': 1404, 'assessment': {'building': 9480, 'land': 6480, 'total': 15960}}, {'year': 2016, 'tax': 1041, 'assessment': {'building': 8030, 'land': 3100, 'total': 11130}}, {'year': 2015, 'tax': 1040, 'assessment': {'building': 8030, 'land': 3100, 'total': 11130}}, {'year': 2014, 'tax': 1056, 'assessment': {'building': 8540, 'land': 2390, 'total': 10930}}, {'year': 2013, 'tax': 1039, 'assessment': {'building': 8540, 'land': 2390, 'total': 10930}}, {'year': 2011, 'tax': 1146, 'assessment': {'building': 8970, 'land': 2710, 'total': 11680}}, {'year': 2010, 'tax': 1114, 'assessment': {'building': 8970, 'land': 2710, 'total': 11680}}, {'year': 2009, 'tax': 1125, 'assessment': {'building': 9210, 'land': 2470, 'total': 11680}}, {'year': 2007, 'tax': 1193, 'assessment': {'building': 9830, 'land': 3100, 'total': 12930}}]",False,6600,284,39.869434,-105.032839,"Central Westminster, Sunset Ridge",Adams,08001,1,0,,3306412,Erik Ledezma,elerikledezma@gmail.com,"[{'ext': None, 'primary': True, 'type': 'Office', 'number': '(720) 429-4981'}]",A-DVCO-594184798,,,,,,,O-DVCO-M4348,Call It Closed International Realty,home@basecamprealty.co,"[{'number': '7192662655', 'type': None, 'primary': True, 'ext': None}]","Colorado Digital BOCES, Westminster 50 School District, Charter School Institute School District",http://ap.rdcpix.com/91ed83ddae799fe6d068403d4c0ce7f7l-m99593231od-w480_h360_x2.webp?w=1080&q=75,"http://ap.rdcpix.com/91ed83ddae799fe6d068403d4c0ce7f7l-m99593231od-w480_h360_x2.webp?w=1080&q=75, http://ap.rdcpix.com/91ed83ddae799fe6d068403d4c0ce7f7l-m3760200703od-w480_h360_x2.webp?w=1080&q=75, http://ap.rdcpix.com/91ed83ddae799fe6d068403d4c0ce7f7l-m555692058od-w480_h360_x2.webp?w=1080&q=75, http://ap.rdcpix.com/91ed83ddae799fe6d068403d4c0ce7f7l-m599880452od-w480_h360_x2.webp?w=1080&q=75, http://ap.rdcpix.com/91ed83ddae799fe6d068403d4c0ce7f7l-m3738156270od-w480_h360_x2.webp?w=1080&q=75, http://ap.rdcpix.com/91ed83ddae799fe6d068403d4c0ce7f7l-m743369975od-w480_h360_x2.webp?w=1080&q=75, http://ap.rdcpix.com/91ed83ddae799fe6d068403d4c0ce7f7l-m2630648792od-w480_h360_x2.webp?w=1080&q=75, http://ap.rdcpix.com/91ed83ddae799fe6d068403d4c0ce7f7l-m1995929821od-w480_h360_x2.webp?w=1080&q=75, http://ap.rdcpix.com/91ed83ddae799fe6d068403d4c0ce7f7l-m3424757013od-w480_h360_x2.webp?w=1080&q=75, http://ap.rdcpix.com/91ed83ddae799fe6d068403d4c0ce7f7l-m2877298665od-w480_h360_x2.webp?w=1080&q=75, http://ap.rdcpix.com/91ed83ddae799fe6d068403d4c0ce7f7l-m389754032od-w480_h360_x2.webp?w=1080&q=75, http://ap.rdcpix.com/91ed83ddae799fe6d068403d4c0ce7f7l-m3413077281od-w480_h360_x2.webp?w=1080&q=75, http://ap.rdcpix.com/91ed83ddae799fe6d068403d4c0ce7f7l-m3723720937od-w480_h360_x2.webp?w=1080&q=75, http://ap.rdcpix.com/91ed83ddae799fe6d068403d4c0ce7f7l-m4057429819od-w480_h360_x2.webp?w=1080&q=75, http://ap.rdcpix.com/91ed83ddae799fe6d068403d4c0ce7f7l-m650617863od-w480_h360_x2.webp?w=1080&q=75, http://ap.rdcpix.com/91ed83ddae799fe6d068403d4c0ce7f7l-m3092190598od-w480_h360_x2.webp?w=1080&q=75, http://ap.rdcpix.com/91ed83ddae799fe6d068403d4c0ce7f7l-m3461316122od-w480_h360_x2.webp?w=1080&q=75, http://ap.rdcpix.com/91ed83ddae799fe6d068403d4c0ce7f7l-m3876981798od-w480_h360_x2.webp?w=1080&q=75, http://ap.rdcpix.com/91ed83ddae799fe6d068403d4c0ce7f7l-m3178848926od-w480_h360_x2.webp?w=1080&q=75, http://ap.rdcpix.com/91ed83ddae799fe6d068403d4c0ce7f7l-m1707280442od-w480_h360_x2.webp?w=1080&q=75, http://ap.rdcpix.com/91ed83ddae799fe6d068403d4c0ce7f7l-m3027131480od-w480_h360_x2.webp?w=1080&q=75, http://ap.rdcpix.com/91ed83ddae799fe6d068403d4c0ce7f7l-m3150557674od-w480_h360_x2.webp?w=1080&q=75, http://ap.rdcpix.com/91ed83ddae799fe6d068403d4c0ce7f7l-m3404464785od-w480_h360_x2.webp?w=1080&q=75, http://ap.rdcpix.com/91ed83ddae799fe6d068403d4c0ce7f7l-m2930083810od-w480_h360_x2.webp?w=1080&q=75, http://ap.rdcpix.com/91ed83ddae799fe6d068403d4c0ce7f7l-m82882862od-w480_h360_x2.webp?w=1080&q=75, http://ap.rdcpix.com/91ed83ddae799fe6d068403d4c0ce7f7l-m2808110060od-w480_h360_x2.webp?w=1080&q=75, http://ap.rdcpix.com/91ed83ddae799fe6d068403d4c0ce7f7l-m1020558891od-w480_h360_x2.webp?w=1080&q=75, http://ap.rdcpix.com/91ed83ddae799fe6d068403d4c0ce7f7l-m3495746906od-w480_h360_x2.webp?w=1080&q=75"
https://www.realtor.com/realestateandhomes-detail/11052-Zephyr-St_Broomfield_CO_80021_M13895-56371,1389556371,2977836384,DVCO,3638057,FOR_SALE,"Stunning 4-Bedroom Home in Prestigious Green Knolls Welcome to this beautiful 4-bedroom, 3.5-bathroom home nestled in the highly sought-after Green Knolls subdivision of Broomfield. Boasting 3, 300 square feet of thoughtfully designed living space, this home offers the perfect blend of elegance, comfort, and modern convenience. Key Features: Spacious & Open Floor Plan Expansive living areas with abundant natural light. Gourmet Kitchen Equipped with high-end appliances, ample cabinetry, and an oversized island, perfect for entertaining. Luxurious Primary Suite A private retreat featuring a spa-like en-suite bathroom and generous walk-in closet. Finished Basement Extra space for a home theater, gym, or guest suite. Beautiful Outdoor Living Enjoy a well-manicured backyard and expansive yard, ideal for gatherings and relaxation. Prime Location Close to top schools, scenic parks, shopping, and dining. With its exceptional location and features, this home is a rare gem in Broomfield. Dont miss your chance to own in one of the areas most prestigious neighborhoods! Schedule your private showing today!",SINGLE_FAMILY,11052 Zephyr St,11052 Zephyr St,,Broomfield,CO,80021,4,3,1,3489,1988,3,885000,,,2025-01-31,600000,2020-08-04,39664,790000,3084,"[{'year': 2022, 'tax': 3084, 'assessment': {'building': 29511, 'land': 10153, 'total': 39664}}, {'year': 2021, 'tax': 3129, 'assessment': {'building': 30360, 'land': 10445, 'total': 40805}}, {'year': 2020, 'tax': 2904, 'assessment': {'building': 27296, 'land': 10782, 'total': 38078}}, {'year': 2019, 'tax': 2857, 'assessment': {'building': 27296, 'land': 10782, 'total': 38078}}, {'year': 2018, 'tax': 2559, 'assessment': {'building': 24254, 'land': 8722, 'total': 32976}}, {'year': 2017, 'tax': 2292, 'assessment': {'building': 24254, 'land': 8722, 'total': 32976}}, {'year': 2016, 'tax': 2370, 'assessment': {'building': 23386, 'land': 8261, 'total': 31647}}, {'year': 2015, 'tax': 2403, 'assessment': {'building': 23386, 'land': 8261, 'total': 31647}}, {'year': 2014, 'tax': 2218, 'assessment': {'building': 20401, 'land': 7209, 'total': 27610}}, {'year': 2013, 'tax': 2223, 'assessment': {'building': 20401, 'land': 7209, 'total': 27610}}, {'year': 2011, 'tax': 2177, 'assessment': {'building': 20983, 'land': 7166, 'total': 28149}}, {'year': 2009, 'tax': 2123, 'assessment': {'building': 20983, 'land': 7166, 'total': 28149}}, {'year': 2008, 'tax': 2156, 'assessment': {'building': 19700, 'land': 7980, 'total': 27680}}, {'year': 2007, 'tax': 2150, 'assessment': {'building': 20070, 'land': 7980, 'total': 28050}}, {'year': 2006, 'tax': 2183, 'assessment': {'building': 20040, 'land': 8090, 'total': 28130}}]",False,12632,254,39.896565,-105.085795,"Green Knolls, West Westminster",Jefferson,08059,2,31,4,3906749,Cody Notch,notchrealty@gmail.com,"[{'ext': None, 'primary': True, 'type': 'Office', 'number': '7202201268'}]",A-DVCO-359723538,,,Resident Realty,,,,O-DVCO-02884,Resident Realty South Metro,chris@denverhomeexperts.com,"[{'number': '(303) 325-5461', 'type': 'Mobile', 'primary': True, 'ext': None}]",Jefferson County R-1 School District,http://ap.rdcpix.com/6a7946fbe36fdbb16be781f5aeac5b1cl-m2752758420od-w480_h360_x2.webp?w=1080&q=75,"http://ap.rdcpix.com/6a7946fbe36fdbb16be781f5aeac5b1cl-m2752758420od-w480_h360_x2.webp?w=1080&q=75, http://ap.rdcpix.com/6a7946fbe36fdbb16be781f5aeac5b1cl-m1892922127od-w480_h360_x2.webp?w=1080&q=75, http://ap.rdcpix.com/6a7946fbe36fdbb16be781f5aeac5b1cl-m1047354601od-w480_h360_x2.webp?w=1080&q=75, http://ap.rdcpix.com/6a7946fbe36fdbb16be781f5aeac5b1cl-m1320496025od-w480_h360_x2.webp?w=1080&q=75, http://ap.rdcpix.com/6a7946fbe36fdbb16be781f5aeac5b1cl-m1670911919od-w480_h360_x2.webp?w=1080&q=75, http://ap.rdcpix.com/6a7946fbe36fdbb16be781f5aeac5b1cl-m3558052001od-w480_h360_x2.webp?w=1080&q=75, http://ap.rdcpix.com/6a7946fbe36fdbb16be781f5aeac5b1cl-m2185542449od-w480_h360_x2.webp?w=1080&q=75, http://ap.rdcpix.com/6a7946fbe36fdbb16be781f5aeac5b1cl-m3186121753od-w480_h360_x2.webp?w=1080&q=75, http://ap.rdcpix.com/6a7946fbe36fdbb16be781f5aeac5b1cl-m2825129734od-w480_h360_x2.webp?w=1080&q=75, http://ap.rdcpix.com/6a7946fbe36fdbb16be781f5aeac5b1cl-m2862174688od-w480_h360_x2.webp?w=1080&q=75, http://ap.rdcpix.com/6a7946fbe36fdbb16be781f5aeac5b1cl-m3565983020od-w480_h360_x2.webp?w=1080&q=75, http://ap.rdcpix.com/6a7946fbe36fdbb16be781f5aeac5b1cl-m3910095354od-w480_h360_x2.webp?w=1080&q=75, http://ap.rdcpix.com/6a7946fbe36fdbb16be781f5aeac5b1cl-m2351951480od-w480_h360_x2.webp?w=1080&q=75, http://ap.rdcpix.com/6a7946fbe36fdbb16be781f5aeac5b1cl-m1076530575od-w480_h360_x2.webp?w=1080&q=75, http://ap.rdcpix.com/6a7946fbe36fdbb16be781f5aeac5b1cl-m4211674158od-w480_h360_x2.webp?w=1080&q=75, http://ap.rdcpix.com/6a7946fbe36fdbb16be781f5aeac5b1cl-m3449293141od-w480_h360_x2.webp?w=1080&q=75, http://ap.rdcpix.com/6a7946fbe36fdbb16be781f5aeac5b1cl-m3835012805od-w480_h360_x2.webp?w=1080&q=75, http://ap.rdcpix.com/6a7946fbe36fdbb16be781f5aeac5b1cl-m4047797488od-w480_h360_x2.webp?w=1080&q=75, http://ap.rdcpix.com/6a7946fbe36fdbb16be781f5aeac5b1cl-m1561528739od-w480_h360_x2.webp?w=1080&q=75"
https://www.realtor.com/realestateandhomes-detail/1170-W-135th-Dr_Denver_CO_80234_M20559-07650,2055907650,2977916044,DVCO,3094249,FOR_SALE,"Looking for a home you can make your own? This 3 bedroom, 2 bathroom property is a diamond in the rough that is ready for your personal touch! Featuring a spacious backyard, perfect for entertaining, gardening, pets, or projects. The oversized 1-car garage provides additional storage or workshop space. This property is SOLD AS-IS, making it an ideal opportunity for investors, flippers, or buyers looking to put in some sweat equity. Conveniently located in the Quail Crossing neighborhood (with no HOA), this home is located near Quail Crossing Park, schools, restaurants, and other amenities. Don't miss out on this property that has tons of potential!",SINGLE_FAMILY,1170 W 135th Dr,1170 W 135th Dr,,Denver,CO,80234,3,1,,1198,1980,0,405000,,,2025-02-03,83900,1994-07-08,22100,457410,2209,"[{'year': 2022, 'tax': 2209, 'assessment': {'building': 16400, 'land': 5700, 'total': 22100}}, {'year': 2021, 'tax': 2282, 'assessment': {'building': 16870, 'land': 5860, 'total': 22730}}, {'year': 2020, 'tax': 2142, 'assessment': {'building': 15280, 'land': 5860, 'total': 21140}}, {'year': 2019, 'tax': 2146, 'assessment': {'building': 15280, 'land': 5860, 'total': 21140}}, {'year': 2018, 'tax': 1799, 'assessment': {'building': 10610, 'land': 6550, 'total': 17160}}, {'year': 2017, 'tax': 1619, 'assessment': {'building': 10610, 'land': 6550, 'total': 17160}}, {'year': 2016, 'tax': 1304, 'assessment': {'building': 10860, 'land': 2550, 'total': 13410}}, {'year': 2015, 'tax': 1302, 'assessment': {'building': 10860, 'land': 2550, 'total': 13410}}, {'year': 2014, 'tax': 1060, 'assessment': {'building': 8040, 'land': 2550, 'total': 10590}}, {'year': 2013, 'tax': 1056, 'assessment': {'building': 8040, 'land': 2550, 'total': 10590}}, {'year': 2011, 'tax': 1140, 'assessment': {'building': 8380, 'land': 2870, 'total': 11250}}, {'year': 2010, 'tax': 1157, 'assessment': {'building': 8380, 'land': 2870, 'total': 11250}}, {'year': 2009, 'tax': 1154, 'assessment': {'building': 8620, 'land': 2790, 'total': 11410}}, {'year': 2007, 'tax': 1287, 'assessment': {'building': 10430, 'land': 3020, 'total': 13450}}]",False,6270,338,39.941726,-105.002618,"Northeast Westminster, Quail Crossing",Adams,08001,2,0,1,3960606,Leslie Bloch,leslie.bloch@cbrealty.com,"[{'ext': None, 'primary': True, 'type': 'Office', 'number': '3037587611'}, {'ext': None, 'primary': True, 'type': 'Mobile', 'number': '3038829056'}]",A-DVCO-611782727,,2184177,Coldwell Banker Realty,,,127312,O-DVCO-CBR01,Coldwell Banker Global Luxury Denver,lane.lyon@cbrealty.com,"[{'number': '3037587611', 'type': 'Office', 'primary': True, 'ext': None}, {'number': '3033774733', 'type': 'Fax', 'primary': False, 'ext': None}]",Adams 12 Five Star Schools School District,http://ap.rdcpix.com/308ba9766d22cbfe45d11978eb07c80cl-m2124326237od-w480_h360_x2.webp?w=1080&q=75,"http://ap.rdcpix.com/308ba9766d22cbfe45d11978eb07c80cl-m2124326237od-w480_h360_x2.webp?w=1080&q=75, http://ap.rdcpix.com/308ba9766d22cbfe45d11978eb07c80cl-m1458885364od-w480_h360_x2.webp?w=1080&q=75, http://ap.rdcpix.com/308ba9766d22cbfe45d11978eb07c80cl-m3370362564od-w480_h360_x2.webp?w=1080&q=75, http://ap.rdcpix.com/308ba9766d22cbfe45d11978eb07c80cl-m2266400482od-w480_h360_x2.webp?w=1080&q=75, http://ap.rdcpix.com/308ba9766d22cbfe45d11978eb07c80cl-m3369303208od-w480_h360_x2.webp?w=1080&q=75, http://ap.rdcpix.com/308ba9766d22cbfe45d11978eb07c80cl-m2651060765od-w480_h360_x2.webp?w=1080&q=75, http://ap.rdcpix.com/308ba9766d22cbfe45d11978eb07c80cl-m2577687934od-w480_h360_x2.webp?w=1080&q=75, http://ap.rdcpix.com/308ba9766d22cbfe45d11978eb07c80cl-m790104356od-w480_h360_x2.webp?w=1080&q=75, http://ap.rdcpix.com/308ba9766d22cbfe45d11978eb07c80cl-m3994987140od-w480_h360_x2.webp?w=1080&q=75, http://ap.rdcpix.com/308ba9766d22cbfe45d11978eb07c80cl-m3264742902od-w480_h360_x2.webp?w=1080&q=75, http://ap.rdcpix.com/308ba9766d22cbfe45d11978eb07c80cl-m2742475590od-w480_h360_x2.webp?w=1080&q=75, http://ap.rdcpix.com/308ba9766d22cbfe45d11978eb07c80cl-m2620258745od-w480_h360_x2.webp?w=1080&q=75, http://ap.rdcpix.com/308ba9766d22cbfe45d11978eb07c80cl-m1444474365od-w480_h360_x2.webp?w=1080&q=75, http://ap.rdcpix.com/308ba9766d22cbfe45d11978eb07c80cl-m870402755od-w480_h360_x2.webp?w=1080&q=75, http://ap.rdcpix.com/308ba9766d22cbfe45d11978eb07c80cl-m467453153od-w480_h360_x2.webp?w=1080&q=75, http://ap.rdcpix.com/308ba9766d22cbfe45d11978eb07c80cl-m1004244962od-w480_h360_x2.webp?w=1080&q=75, http://ap.rdcpix.com/308ba9766d22cbfe45d11978eb07c80cl-m38810351od-w480_h360_x2.webp?w=1080&q=75, http://ap.rdcpix.com/308ba9766d22cbfe45d11978eb07c80cl-m3188527786od-w480_h360_x2.webp?w=1080&q=75, http://ap.rdcpix.com/308ba9766d22cbfe45d11978eb07c80cl-m3198329939od-w480_h360_x2.webp?w=1080&q=75, http://ap.rdcpix.com/308ba9766d22cbfe45d11978eb07c80cl-m76334378od-w480_h360_x2.webp?w=1080&q=75, http://ap.rdcpix.com/308ba9766d22cbfe45d11978eb07c80cl-m3924742667od-w480_h360_x2.webp?w=1080&q=75, http://ap.rdcpix.com/308ba9766d22cbfe45d11978eb07c80cl-m239101916od-w480_h360_x2.webp?w=1080&q=75, http://ap.rdcpix.com/308ba9766d22cbfe45d11978eb07c80cl-m2105225155od-w480_h360_x2.webp?w=1080&q=75, http://ap.rdcpix.com/308ba9766d22cbfe45d11978eb07c80cl-m2616962612od-w480_h360_x2.webp?w=1080&q=75, http://ap.rdcpix.com/308ba9766d22cbfe45d11978eb07c80cl-m937087921od-w480_h360_x2.webp?w=1080&q=75, http://ap.rdcpix.com/308ba9766d22cbfe45d11978eb07c80cl-m2116510458od-w480_h360_x2.webp?w=1080&q=75, http://ap.rdcpix.com/308ba9766d22cbfe45d11978eb07c80cl-m3413244611od-w480_h360_x2.webp?w=1080&q=75, http://ap.rdcpix.com/308ba9766d22cbfe45d11978eb07c80cl-m1339290043od-w480_h360_x2.webp?w=1080&q=75, http://ap.rdcpix.com/308ba9766d22cbfe45d11978eb07c80cl-m3614998274od-w480_h360_x2.webp?w=1080&q=75"
https://www.realtor.com/realestateandhomes-detail/5428-W-115th-Dr_Westminster_CO_80020_M26413-69761,2641369761,2977891714,DVCO,5874963,FOR_SALE,"Torrey Peaks 2-story! Elegant Acacia hardwood floors on main level with cathedral ceiling in Great Rm. Coolest kitchen ever with tons of soft close cabinets, granite counters, stainless appliances & commercial accents. Brand new paint inside and new roof 2018. Full finished basement offers huge rec room, bedroom and 3/4 bath. New furnace and ac in 2024. Tankless water heater. Enjoy all that Torrey Peaks has to offer with Ryan Park close by.",SINGLE_FAMILY,5428 W 115th Dr,5428 W 115th Dr,,Westminster,CO,80020,4,2,1,2248,1988,0,600000,,,2025-02-03,429000,2019-12-11,28438,592554,2211,"[{'year': 2022, 'tax': 2211, 'assessment': {'building': 21646, 'land': 6792, 'total': 28438}}, {'year': 2021, 'tax': 2243, 'assessment': {'building': 22269, 'land': 6987, 'total': 29256}}, {'year': 2020, 'tax': 2148, 'assessment': {'building': 20599, 'land': 7567, 'total': 28166}}, {'year': 2019, 'tax': 2113, 'assessment': {'building': 20599, 'land': 7567, 'total': 28166}}, {'year': 2018, 'tax': 1687, 'assessment': {'building': 17182, 'land': 4555, 'total': 21737}}, {'year': 2017, 'tax': 1510, 'assessment': {'building': 17182, 'land': 4555, 'total': 21737}}, {'year': 2016, 'tax': 1559, 'assessment': {'building': 15371, 'land': 5445, 'total': 20816}}, {'year': 2015, 'tax': 1581, 'assessment': {'building': 15371, 'land': 5445, 'total': 20816}}, {'year': 2014, 'tax': 1301, 'assessment': {'building': 11582, 'land': 4618, 'total': 16200}}, {'year': 2013, 'tax': 1304, 'assessment': {'building': 11582, 'land': 4618, 'total': 16200}}, {'year': 2011, 'tax': 1297, 'assessment': {'building': 12529, 'land': 4244, 'total': 16773}}, {'year': 2009, 'tax': 1274, 'assessment': {'building': 12529, 'land': 4244, 'total': 16773}}, {'year': 2008, 'tax': 1296, 'assessment': {'building': 11390, 'land': 5220, 'total': 16610}}, {'year': 2007, 'tax': 1292, 'assessment': {'building': 11640, 'land': 5220, 'total': 16860}}, {'year': 2006, 'tax': 1294, 'assessment': {'building': 11650, 'land': 5030, 'total': 16680}}]",False,3609,267,39.907066,-105.055665,"Central Westminster, Torrey Peaks",Jefferson,08059,2,35,2,3701272,Rona Gates,ronagates@gmail.com,"[{'ext': None, 'primary': True, 'type': 'BUSINESS_MOBILE', 'number': '3039135538'}]",A-DVCO-603813559,,3603271,HomeSmart,,,168649,O-DVCO-1HOME,HomeSmart ,jdavis2@qwest.net,"[{'number': '3038588100', 'type': 'Office', 'primary': True, 'ext': None}, {'number': '3038588100', 'type': 'Mobile', 'primary': True, 'ext': None}]","Jefferson County R-1 School District, Charter School Institute School District",http://ap.rdcpix.com/8c881f8298ce85c5bd453127f1dacdcal-m3559262127od-w480_h360_x2.webp?w=1080&q=75,http://ap.rdcpix.com/8c881f8298ce85c5bd453127f1dacdcal-m3559262127od-w480_h360_x2.webp?w=1080&q=75
